"speaker","cleaned_text"
"teacher","okay all right so i ve been telling you guys everybody for a few weeks now that we were going to do a lesson on probability because you ve been asking me about it a lot you love to ask questions about math and up until now we haven t had time so now we have time and we re going to do some really fun experiments that have to do with probability too does anybody remember what probability is what does probability mean student e"
"student","i think it means that it may happen"
"teacher","exactly it s the likelihood of if something is going to happen how likely something is to happen okay so it s about something that hasn t happened yet and how likely that thing is to happen and basically probability has been sneaking into our math a few times this year i know you ve seen it before i see some of you nodding your heads it has snuck in there and it also sneaks into our daily lives for example when you ask me every day about the weather and i use my phone and i look at the weather and i check out what the temperature is on the phone i see the weather and i do this application that says local weather today which student k guessed right the weather is 59 degrees and then it gives you the weather on wednesday and if i hit wednesday it will show me the times and it shows the little rain thing because it s supposed to rain today right and it ll give next to that a percent sign 9 00 am it says 60 percent why do you think there s a percent sign next to the rain that says 60 percent student e"
"student","i think they mean the amount of rain inaudible"
"teacher","okay so if it says 60 percent do you think that it means that it s definitely going to rain"
"student","no"
"teacher","what do you think that means turn to the person next to you and talk and then talk to me okay turn back to me actually just so you know when i look on my phone it says 60 percent all the way up until it has a little rain sign it says 60 percent all the way up until 4 00 o clock and then it changes to 50 percent but up until 4 00 o clock which is our whole day that you re in school it shows you this sign which is supposed to be the rain right and next to it says 60 percent so why do you think that it says 60 percent student l what did you guys say"
"student","maybe because it s going to rain it might be maybe or likely"
"teacher","okay i like how you re using those words because we did briefly earlier in the year go over some of these words first you said maybe and then you said likely are those the same thing maybe and likely"
"student","no"
"teacher","they re not the same thing do you agree with student l that they re not the same thing shake your head yes if you say that no they are the same thing put your hand up in the air so student l you re saying they re not the same how are they different how is maybe different from likely student j"
"student","because maybe is like the half and likely is like more like you agree"
"teacher","good memory so likely is more than half and with 60 percent why is student l saying that it s likely rather than maybe rather than the half what percent would it be if it was half"
"student","50"
"teacher","50 percent so this is actually the reason that it puts these percentage signs is the chance that it s going to rain during the day there is a 60 percent chance that all day long up until 4 00 o clock where it changes to 50 percent the weathermen have predicted they ve forecasted that there s a 60 percent chance that it is going to rain which means it s more than maybe it s likely that it s going to rain 60 percent chance it s not 100 percent chance what would it be if it were a 100 percent chance that they said it was going to rain raise your hand raise your hand i love the thinking but raise the hand student j"
"student","i think like it s going to rain all day i mean they re going to be sure it s going to rain"
"teacher","totally they re going to be sure and do you remember the word that i taught you with that"
"multiple students","certain"
"teacher","remember when this came up earlier this year we just did this really quickly but i wanted to kind of take some more time with this today we did what we called the likelihood line do you remember that earlier this year"
"multiple students","yes"
"teacher","and we had certain here and what did we have here"
"multiple students","impossible"
"teacher","exactly impossible and if i were looking at percentages what would impossible mean"
"multiple students","zero"
"teacher","zero percent chance of something happening and if you re looking at certain don t say it out loud i want to call on someone if you re looking at certain what would the percentage be if something is definitely going to happen i should see more hands something s definitely going to happen student e"
"student","100"
"teacher","100 percent and then student j you just told us what would maybe be student j"
"student","50 percent"
"teacher","50 percent does anybody remember what goes here what was that word that goes here i see some hands as people are remember and i m so proud of you for not calling it out let your classmates think there s a word that went here when we did this and there was a word that went here and actually student l said one of the words when he decided that there was a hmm chance that it was going to rain today 60 percent or a he said it wasn t maybe but it was something else now i should see all hands up including yours student l good i m glad i see your hand up ah student g"
"student","likely"
"teacher","likely and likely can really mean anything from 51 percent to almost 100 percent is likely it could be likely over here and like it s really really really likely or it could be likely down here next to maybe it can be anywhere from here to here so it s not necessarily just 75 percent but it could be anything from here to here and what do we put here student a"
"student","unlikely"
"teacher","unlikely and again it can be anywhere from zero to 50 percent okay so that s what we call the likelihood line and student l you were absolutely correct that today it s likely that it s going to rain there s a 60 percent chance it s going to rain it s not certain they are not certain that it s going to rain but it s likely okay then at 4 00 o clock it changed to 50 percent so it s like maybe it will rain maybe it won t and that s interesting because that s how they use forecasts every single day with probability so remember i said it s been creeping into our math a little bit during the year but it s also been creeping into our daily lives because i use this every day i look at the weather every day to see like wait is it going to rain today and you probably do too and you don t even know it your parents probably look at the weather and say wear your rain jacket today student e it s supposed to rain or no student l it s not supposed to rain today you don t need a rain jacket and they use it with snow and all kinds of weather right questions"
"student","my mom always looks at the weather every day so if she says wear a jacket or wear a sweater"
"teacher","exactly and she s looking at the likelihood of what s going to happen because it s not as common that they say 100 percent this is going to happen because they can always be a little bit wrong sometimes they do once in awhile they do especially as it gets closer to the hour and you can see a cloud coming it s like okay it s going to rain 100 percent you know but most of the time we re somewhere in this likely area or even you could be down here if there s just a little chance something could happen so the first thing we re going to do with our likelihood line is we re going to define an event as likely unlikely maybe likely or certain so that s our first objective for today and i m going to give you a sheet of paper you re going to work with partners and there s an event there s actually a lot of events on the paper where are my papers oh right here hiding from me so you can see that there s a bunch of different events on here 1 2 3 4 5 1 2 3 4 5 how many is that"
"multiple students","10"
"teacher","okay 5 x 20 is 10 so there s 10 events and you re going to have to read the event with your partner and you re going to have to decide where you re going to put this on the likelihood line you re going to decide are you going to make it impossible unlikely maybe likely or certain and you ll be surprised it looks easy student e but as i m walking around we ll see i might hear you saying well no i think this i think this but the most important thing is i want to hear you as i m walking around talking about why you picked this choice so why did you say okay we should put this under maybe why did you say we should put this under likely or under certain"
"student","inaudible"
"teacher","huh"
"student","i inaudible that piece of paper"
"teacher","so what we re going to do is i have a piece of paper i ll have this up for you so you can see and it says what is the likelihood and we ve got our line here impossible unlikely maybe likely certain when i drew this line i did this yesterday after school and i decided that it was easiest to use a ruler because otherwise my line went all crazy so use a ruler the other thing is i thought it was easiest to put maybe first because maybe goes where"
"multiple students","the middle"
"teacher","right in the middle so it s easier because then you can start making your other lines so you put your maybe first in the middle then what do you think you should maybe put"
"multiple students","certain"
"teacher","yes because it goes right at the end and notice how i put the little line right at the end but i wrote the word kind of like i had to start it over here so i could fit the whole word and the same here with impossible i put the line here because that s really zero percent right but i had to start my word over here and take it over to there and then in the middle of course is unlikely and likely and what you re going to do is you and your partner are going to cut out each event and you re going to decide where you re going to put this on the line are you going to put it here here here here or here for example a helicopter will land on our school roof today don t tell me what you re going to pick but you re going to cut this out and you re going to decide am i going to put this under maybe am i going to put this under impossible am i going to put this under unlikely what am i going to put this under everybody understand any questions"
"multiple students","no"
"teacher","glue sticks you know where they are you re only going to need one glue stick per partner and you really only need well you can both have scissors to help each other cut or you can just use one scissor i would just cut down the front just make it fast yes student j"
"student","do we have to trace that"
"teacher","trace what"
"student","that"
"teacher","this yes so the first thing that you should do is make your likelihood line or actually one person could be cutting while the other person is making the likelihood line that would make sense so one person cuts this out while the other person is making the likelihood line and go ahead and fill this in and write what is the likelihood does that make sense that way you can divide up your jobs because you re only going to have one partner that you re working with"
"student","do we need our math notebook"
"teacher","you do need your math notebook but not yet student j so if you d just do me a favor and bring it back because we re going to meet on the run after this we re going to share this and this is just part one this is our part one to our probability lesson then we re going to have a part two after this everybody understand because i want to share what you came up with with your partner okay you may choose your partners except that student c where are you"
"student","she s not here"
"teacher","oh was it student c or student j who was working with student p yesterday"
"student","student j"
"teacher","was it you i thought it was student c for some reason and then i m looking at you and i m thinking wait a minute i think it was you okay student j will you work with student p because you did a great job yesterday of explaining things in spanish and english and all that great stuff everybody else can work with whoever you want i m going to come over and see hold on once you have your partner you need one of these you need one of these so come get one you need one of these and you know where the markers are you can get a marker for your partner here you go just take one one for each partner group one stick set over there oh one thing guys guys please don t work at the back table no back table i want you on this side of the room so that the camera can see you no back table this morning you can work on the rug you can work over here or over here i ll keep this up here in case you need to see did you get one for the group i thought you were with student a"
"student","we come here right"
"teacher","yeah i would come here or you could be at these desks here you could be there just not on that back table over there"
"student","i don t have a partner"
"teacher","you don t have a partner student l oh that s right because somebody s absent you ll have to join a group of two student a who s your partner who would you like to join student l you need glue sticks you need one glue stick"
"student","can you use regular glue"
"teacher","no glue stick is easier why do you have glue at your desk student e if you want that s fine i just think the glue stick works a little better"
"student","glue stick works a little better"
"teacher","student k and student d can student l join your group"
"student","yes"
"teacher","you can go over to their group"
"student","this is a weird question"
"teacher","some of them are kind of funny"
"student","more than 100 people in boston will order pizza today"
"teacher","why is that weird do we have pizza places in boston well"
"student","shall we write the question down or just that"
"teacher","so you re going to write down what is the likelihood right at the top and make your line and you want to make your line up top boys and girls when you re making your line student s make it up top so you have room to paste so your line should be kind of up towards the top girls did you hear that your line should be up top student j did you hear that with the line drawing it up top"
"student","inaudible what is the likelihood"
"teacher","what is the likelihood mm hmm what is the likelihood of something happening student g who s your partner why don t you start cutting you can be cutting while she s doing the line"
"student","miss m did you see the boston and celtics"
"student","i like this one it s hilarious"
"teacher","i did see that"
"student","boston and celtics"
"teacher","i know i saw it i know it was a close game"
"student","they were so close to winning"
"student","one of the people scored a lot"
"teacher","i know it was a good game all right guys let s concentrate on what you re doing do you girls have a glue stick"
"student","inaudible"
"teacher","yes i think that s fine do we have a glue stick here"
"student","how will we know about this one"
"teacher","you talk about it together"
"student","the earth is round you need to go into outer space to find that out if it was flat it would be inaudible"
"teacher","boys and girls one thing i m noticing like with this group before they glue they re setting up where they re going to put each of the events i think that s a good idea because maybe you might decide oh wait i want to switch something around so before you glue maybe you should set them up and then glue when you re all finished"
"student","inaudible i m not sure about that it might be likely"
"student","i don t know about that"
"student","i wish i could tell the future"
"teacher","remember impossible is when you know that it absolutely 100 percent cannot happen it will not happen 100 percent just to give you an idea of pacing you should be looking at your events by now your line should be done and you re ready to set up your events so if that s not done you need to work a little faster so you can get your events set up okay you guys are ready you re good so student j you re spending a little too much time on this faster so you can get to the actual math part okay hon student e who cut who was cutting quick finish cutting so you re all set up so you re ready to start as soon as she s done you want to be efficient so you can get to the good stuff turn it this way so you can see it that s how you re going to tape it why don t you switch them right over here so you can have a flat surface quick quick quick girls right now you should be done with this part you should have the line drawn and you should be ready to set your events up okay good girls you re at a good pace girls you ve got to work a little faster get this set up quickly so you can get to the good stuff all right student j good she should be done you should be ready to start quick help her cut this cutting s got to go a lot faster quick quick quick okay start reading your events"
"student","is this fine"
"teacher","yes but you ve got to be a lot faster quick get that line drawn and get started so that you can get to the good stuff most people are almost done with this so come on speed up work together to be really fast quick quick quick why don t you get the cards ready so that you re all ready to start so i m curious at least 100 cars will pass our school during the day today you say that that s impossible there s no chance no it s not she said it you re working together so you want to talk about it and decide with each one it s not you say one she says one we say what do we think together so try again student j when i say try again i mean talk about it so it s not just what do you think but why why do you think that so if student p chooses impossible can you ask her why she s choosing impossible hold your card up this is the one you re talking about does she know what this means"
"student","yes i inaudible"
"teacher","okay do you agree with her i m talking about this one do you agree with her for this one student j"
"student","i m kind of like an unlikely"
"teacher","oh okay that s why you were pointing to that i m sorry so why are you kind of like unlikely"
"student","because there s lots of teachers and parents that come to the school to drop people off to come to school but there s lots of cars"
"teacher","so can you explain that to her student translates in spanish and that s just parents who are dropping their kids off there s parents dropping their kids off there s people visiting the school but there s people who just drive by the school not because they want to come to school but because this is a street so do you still think that it s unlikely during the school day how long is the school day"
"student","during the day today"
"teacher","how long is the day today what time do we start school"
"student","8 00 inaudible"
"teacher","right and kids probably start being dropped off at 7 00 something so 7 00 until 4 00 o clock in the afternoon 4 30 with the programs that s a lot of hours students translates what do you think student j"
"student","i think it s kind of like maybe"
"teacher","so you think 50 50 it could be but it could not be okay so let s see did you all agree on all of these you did okay there s quite a few of these that i disagree with so why don t you take a look at them again remember impossible is when something absolutely cannot happen so let s check on impossible list first valentine s day will be next month absolutely impossible when is valentine s day"
"student","inaudible"
"teacher","do you remember when it is do you remember what month valentine s day is in"
"student","june"
"teacher","no it already happened june hasn t happened yet this year what month already happened"
"student","april"
"teacher","no valentine s day is in february february 14th okay so you were right that valentine s day will not be next month because it did already happen it happened in february look at the next one half the students in our school will stay home with colds tomorrow is that impossible"
"student","yes"
"teacher","why is that impossible"
"student","because if half the class is missing inaudible"
"teacher","what if everyone got sick and got horrible horrible colds and ten kids were absent"
"student","inaudible"
"teacher","then they would stay home is that impossible i think it probably won t happen where would you move that to"
"student","maybe"
"teacher","no not maybe i said it probably won t happen"
"student","unlikely"
"teacher","yes this is one of those unlikelies that s probably right next to impossible it s probably right there it s almost almost almost impossible but if all of a sudden there was a really bad like flu and colds it could happen but it s like this much of a chance of it happening so tiny tiny tiny but it s still not absolutely impossible what about this one"
"student","inaudible"
"teacher","so you chose impossible for that what does a helicopter need to land on a roof how does it need to be what does the roof need to be like"
"student","inaudible destroying inaudible it would destroy the school"
"teacher","no helicopters can land on top of buildings have you ever seen that before they land on top of buildings what does the build need to be for the helicopter to land what kind of building does it need to be like how does the top need to be"
"student","inaudible"
"teacher","it needs to what"
"student","inaudible"
"student","it has to be a really wide roof"
"teacher","yes and what else it has to have enough space and what else does it have to be"
"student","it needs to be flat"
"teacher","yeah that s it student j it has to be flat so if you think about our roof do we have a flat roof if the roof were like this then the helicopter couldn t land on it right but if you have a flat roof and you have enough space remember a helicopter is not a huge plane it s those little ones then it would be able to land on the roof do we have a flat roof"
"student","yeah i think so"
"teacher","so if it s flat if there s a flat spot where we can walk on the roof and it s completely flat then a helicopter could land it would probably be again really close to impossible but it s like so close to this it s totally close to it so you re on the right track but it s not absolutely impossible if there was an emergency it could happen sometimes helicopters have to land on roofs of buildings for emergencies all right let s check this one out our class will get ten new students before the end of the school year"
"student","that s impossible"
"teacher","you think it s impossible"
"student","i don t think students would go to school when it s going to be at the end of the year"
"teacher","okay you don t think but"
"student","it s unlikely"
"teacher","mm hmm once again and you know what s funny about that student j is that one year when i was teaching here i had a lot of students that came in may like four new students i had four new students come because they were coming from different countries and the school years were different they re different like when they begin in the school year and when they end it was different so their school year was over and then they came here so it s interesting again it s probably not going to happen but it s again really close to impossible"
"student","unlikely"
"teacher","yeah you were right that they re almost impossible if i were putting them on the line i d put them right there almost next to impossible scientists will discover that the earth is flat"
"student","i don t think so"
"teacher","because what is the earth"
"student","it s round"
"teacher","we know it s round so that is impossible so you were absolutely right"
"student","because inaudible told us that back in the old time this guy named columbus something he thought that the world was flat and he kept on traveling and traveling and so then he thought that the world was flat"
"teacher","but what did they discover"
"student","that it was round"
"teacher","round so we ve already discovered that so he was thinking it was flat he didn t know for sure and then he discovered that it was round okay so let s move on to the maybes more than 100 people in boston will order pizza today do you know how many people there are in boston boston is huge do you know how many pizza places there are in boston lots think about your neighborhood what about your neighborhood how many pizza places do you have i have three in my neighborhood do you know how many you have how many"
"student","one"
"student","two"
"teacher","you have two student l you re in east boston i can think of more than one i know there s more than one in east boston because i remember because i ve gotten pizza here before there s san tarpios have you ever been to san tarpios that s another place there s at least two"
"student","i live inaudible"
"teacher","you do"
"student","well not really next to that but inaudible"
"teacher","so there s three or four pizza places in each neighborhood and there s tons of neighborhoods in boston so more than 100 people in boston will order pizza today i m not sure if that s a maybe or if that should be over here somewhere"
"student","probably certain because there s probably like over 1000 people in east boston"
