"speaker","cleaned_text"
"teacher","so yesterday we started a conversation about this question right here can someone read the question please student c"
"student","miss inaudible owned a native bookstore she had 56 apples to arrange in rows for her inaudible window display she has room for four rows in her window how many apples will be in each row if she puts the same number in each row"
"teacher","and we also talked about the important pieces of information so what are the important pieces of information from this problem student a"
"student","56 apples to arrange in four rows"
"teacher","so 56 apples and they needed to be arranged in four rows and then what is the question that we needed to stay focused on student f"
"student","how many apples will be in each row if she puts the same number in each inaudible"
"teacher","so we underlined that information yesterday 56 apples four rows that they needed to be arranged in and then how many apples will be in each row and we have to keep in mind that the same number had to be in each row how did we approach this problem yesterday what were you thinking about you had the option to use cubes the tiles and grid paper so what were you thinking about yesterday student a"
"student","we do our making rows"
"teacher","could you say that a little bit louder"
"student","we were making rows to find we were making four rows and then if they to ought to have the same tiles in each then that s the answer"
"teacher","so four groups with the same number of tiles in each group and then if they were all the same that was the answer and so you used tiles any other thoughts student v"
"student","i used inaudible"
"teacher","a little bit louder"
"student","i just did it inaudible"
"teacher","and how did you do it if you need to grab your notebook feel free"
"student","i did half of each inaudible and half inaudible"
"teacher","just talk a little bit louder"
"student","i did half of 56 equals 28 and then i did half of 28 equals 14 and that inaudible teacher can you explain why that worked"
"student","you had 28 inaudible"
"teacher","a little bit louder i can t even hear you"
"student","half of 56 is 28 and then the other half is 28 and half of 28 is 14 and you get two inaudible out of 28 you get two 14s out of 28 equals the other two inaudible"
"teacher","but why are you cutting 56 in half and then cutting 28 in half"
"student","inaudible"
"teacher","so you re doing this to get four groups so when you took the half of the 56 and you got 28 how many groups did you have"
"student","i can t inaudible two 28s"
"teacher","so here you had two groups of 28 and then you took those two groups"
"student","split them in half"
"teacher","split them in half again and so then you ended up with how many groups"
"student","four"
"teacher","four groups"
"student","of 14"
"teacher","of 14 can somebody else explain what she s talking about or at least get us started on another way to explain this idea student r"
"student","i used cubes to find out the equation of 56 divided by 4"
"teacher","can you help talk about this idea first why do you think student v was cutting 56 in half and then again in half so she got an answer of 28 and then she took that 28 and cut that in half again student r give it a try"
"student","it s like if you wanted to split it down 56 you ll get 28 and then inaudible to get your inaudible answer you just inaudible on the 28 14 and inaudible"
"teacher","and so that s a start i m gonna call on someone else student r what are you thinking"
"student","she just cut it in half the 56 into inaudible the 28 to get 14"
"teacher","why"
"student","because if you divide 28 then you try and to make four groups"
"teacher","keep thinking student a"
"student","she cut inaudible i mean she inaudible but two 28s and four rows she has to cut it down so there can be four"
"teacher","student b"
"student","i think she could that because 28 plus 28 equals 56 and then 14 is half of 28 because if you cut it in half 14 take off half of the 28"
"teacher","student v did you draw any picture in your notebook"
"student","yeah"
"teacher","can you come up and draw it on the overhead what you drew student r wants to add to that while she s working on her picture"
"student","yeah i just wanted to see something four is a factor of inaudible four is a factor of 28 and four is a factor of 14 and"
"teacher","if we count by fours will we land on 14 no we don t so maybe factor isn t the right idea but maybe what you re thinking about"
"student","just think if you take the 14 and then you take the inaudible it s almost the inaudible length as the inaudible like 4 times 2 equals 8"
"teacher","you mean the 8 from the 28"
"student","yeah"
"teacher","i think i want to concentrate more on why she s breaking these numbers in half long pause so is that what your picture looked like can i actually 56 i actually want to draw the first idea that you said so he has 56 that s what i feel like i heard when you said that you cut the 56 in half and you show it in this picture but it s really that picture really shows the 14s"
"student","uh huh"
"teacher","it equals that 28 each time for the two groups"
"student","that s right"
"teacher","yes so here s the 56 and she said so first she cut it in half and she gets 28 how many groups does she have when it s cut in half and there s 28 in each group how many groups is that student k right here how many groups does she have"
"student","inaudible"
"teacher","she has two groups so if we transfer that idea to the question we re talking about rows does mrs sanchez only want two rows"
"multiple students","no"
"teacher","how many rows does mrs s want"
"multiple students","four"
"teacher","so i m guessing that student v is now thinking okay well i can get a four out of there all i need to do is cut those groups in half again and luckily these numbers work pretty nicely when we re cutting them in half so there s no leftovers there s no number that we have to share so when she cut it in half now in each group there are 14 do you see the picture that matches what she s talking about cutting these ideas cutting these numbers in half"
"multiple students","yes"
"teacher","so she first cut the 56 in half and the 56 gets cut in half and it was 28 and 28 then she took it and she cut it again in half and it got to be 14 for the four groups so she knew her final answer had to be 14 because that means there would be 14 in each row student l are you with me up now a lot of you built this with tiles a lot of you built this with tiles and you just had an array and you had four rows with 14 in each and i m not going to do the entire thing but this is how you got started right"
"multiple students","yes"
"teacher","if you use the tiles or you use the cubes how did you know how to start arranging them on your desk how did you know how to start arranging them on your desk student r"
"student","you could put 56 and inaudible five tens and then six ones and then inaudible the fact that 56 was 28 and half of 28 was 14 you could put the 14 in four rows"
"teacher","so say that again"
"student","you have about ten groups of five and then a group of six ones and then if you know half of 56 is 28 and half of 28 is 14 you can put the 14 into two rows inaudible"
"teacher","so you re actually building up on that idea here you re just using the tiles anybody else have an explanation as to how you arranged your tiles how you knew to do the four rows on your desk student s"
"student","miss r i noticed something"
"teacher","what did you notice"
"student","that four s a factor of 28 i mean four is a factor of 28 and inaudible is a factor of 14 so if you inaudible 28 to inaudible 14 it gives you the answer"
"teacher","it is four a factor of 14 if we count by fours do we get to 14"
"student","no"
"teacher","no we talked about that with student r a few minutes ago but four is part of that 28 and that s one of the reasons why we re able to inaudible this up here and then inaudible so any other thoughts as to how you arranged your tiles on your desk student k"
"student","inaudible"
"teacher","student c laughter"
"student","i kept the inaudible in inaudible"
"teacher","so you took out all 56"
"student","and inaudible was inaudible groups inaudible i got my answer"
"teacher","when you had the 56 did you put them into four groups one at a time one one one one"
"student","inaudible"
"teacher","how did you start organizing that"
"student","one group of 14 and then a group of inaudible"
"teacher","so when you were passing out the tiles did you say one tile to the first row another tile to the second row one more tile to the third row to the fourth row student a"
"student","we could break them down to two groups you could start off at 12 and then each row could put 12 and then if that doesn t work just add on"
"teacher","so you started off by putting 12 in each row"
"student","yes inaudible"
"teacher","and so that actually would be 12 times 4 right and then you added on by ones from there so that s a little bit different than just passing out one at a time and that s actually something that i want you to focus on today whether you re using manipulatives or you re drawing a picture or you re just writing down equations i want you to try to think about these ideas by passing them out in groups so instead of passing out one to each group at a time think about how you can pass out a larger amount so student a is saying that he could have given 12 to each row so that would be the four groups of 12 and then we have all the extras that get us up to 56 that we can pass out by ones or maybe if you have enough and you can tell that you have enough you can pass them out by two student f"
"student","i put all the inaudible pieces and then i put them in rows i put 11 in each row and then i had 12 more left and then i put inaudible other ones inaudible and got 13"
"teacher","so that s even another idea so instead of doing the 12 in each row you could also do 11 in each row which would be your 11 times 4 and then add on the additional ones from there so same idea as student a but just a different amount that you re doing a bigger chunk this reminds me of when you re doing the bigger array small array you re trying to make smaller arrays that can help you solve the larger problem so you need to keep all of these things in mind today when you re working on this how are you going to figure out what the final answer is how are you going to represent that answer and how are you going to figure out what the final answer is are you doing it with larger groups are you passing things out by ones are you just looking at the tiles are you just looking at your cubes do understand what i m saying"
"multiple students","yes"
"teacher","my last question before we get started with today s activity some of you yesterday started doing this 56 times 4 equals blank a couple of you caught yourself and said oh that wasn t what the problem was asking a couple of you i asked you a few questions and then you were able to say no that s not what we re doing why isn t this problem 56 times 4 again here s the problem we have mrs s who owns a neighborhood store she has 56 apples to arrange in rows and she wants four rows how come the problem does not work for 56 times 4 student h if you need to move your seat please do so how come 56 times 4 is not what we wanted to do student d"
"student","because you re trying to 56 inaudible in four rows"
"teacher","you re trying to get to 56 in four rows student v"
"student","inaudible"
"teacher","it s going to equal a much bigger number and those of you that i spoke to yesterday you had a very large number and my first question to you is it possible to have that many in each row if all you have is 56 you had a number in the 200s didn t you"
"multiple students","yes"
"teacher","and so if we have a number in the 200s is that going to work if all together we only have 56 apples"
"multiple students","no"
"teacher","so think about these ideas is your answer reasonable yes"
"student","you can t use time tables you can t use a time table so that became division"
"teacher","so how do we write that s division"
"student","56 divided by 4 equals 14"
"teacher","so it s not this but we can write 56 divided by 4 equals our answer of 14 so we re moving into divisions problems you can take a seat right next to student r if that works or you can take a seat right next to student s yes"
"student","i did it solving inaudible different way i knew 28 plus 28 equals 56 and 14 plus 14 equals 28 so i did 14 plus 14 equals 28 you take away get rid of the 14 and inaudible"
"teacher","so maybe that was a similar thinking that we had here with student v yes"
"student","can you take a number line"
"teacher","how would you do it with a number line"
"student","inaudible"
"teacher","so maybe try it today and see if what the problems today if it would work on the number line and maybe jumping in a certain number of groups because last year in third grade you did multiplication with jumping on a number line so maybe that idea will help you here too so what i need you to do is take out your math books you need to grab pages 16 and 17 tear them out unit three"
"student","unit three"
"teacher","yes 16 and 17 long pause as soon as you get those pages out you can get started you have the choice of using equations pictures manipulative they re on the counter graph a grid paper your choice and as long as things inaudible moving like yesterday you re all set crosstalk yes yes crosstalk"
"teacher","okay it looks like most of you are ready to start remember to think about how can you do this in bigger groups instead of just passing out one at a time"
"teacher","boys and girls when you re figuring out the problem it would be helpful if you have a multiplication or a division sentence written some of you have done that already but if you haven t please try to do that"
"teacher","we re gonna work for about five ten more minutes"
"teacher","in three more minutes we re going to stop"
"teacher","one more minute"
"teacher","all right i want everybody to get to a stopping point please and i want you to turn your attention back to number one even though the majority of you have finished that one quite a bit ago student l student l"
"student","yes"
"teacher","we ll take care of that afterwards just take your seat can somebody read problem number one out loud student a"
"student","48 fourth graders at the glendale school are taking a field trip to the science museum they need to put into their group of three students for a special science project at the museum how many groups will there be"
"teacher","what are the important pieces of information from this problem student l tell me something that you know that s important about number one"
"student","they re going on a field trip"
"teacher","i m sorry"
"student","they re going on a field trip"
"teacher","that is important but what are the pieces of information we need to know to solve the problem student w"
"student","inaudible into three groups"
"teacher","three groups student v"
"student","48 divided by three"
"teacher","before we get to any equation i want to know the important pieces of information so three groups is an important piece so that three is important student c"
"student","there are 48 fourth graders"
"teacher","so there are 48 students and is it telling you that there are three groups or three students in each group"
"multiple students","three groups"
"multiple students","three students in each group"
"teacher","so i m hearing both so i wonder if it matters when it comes down to solving the problem is it okay if we have three groups is it okay if we have three students in each group so i m actually going to put both here what is the equation that we will use to solve this problem without the answer so equals blank student s"
"student","48 divided by three"
"teacher","do we agree on that"
"multiple students","yes"
"teacher","student r student l go switch so we don t have please do we agree it s 48 divided by three equals blank"
"multiple students","yes"
"teacher","so can someone get us started how do we solve this problem i need student l student a and student a i need eyes up here how do we start this problem student k can i have hands off cubes and tiles so that we can hear what everyone s saying"
"student","inaudible times three equals inaudible"
"teacher","that s an excellent start can someone tell me why this is a good start what does three times ten equal thirty tell us why is it a good start student a"
"student","inaudible"
"teacher","okay student r"
"student","it s a good start because the three from the 48 divided by three you put it in inaudible times ten and you end up where the ten is you ll get your answer"
"teacher","what do you mean where the ten is we re gonna get our answer"
"student","if you keep adding them up to 48 then inaudible your answer"
"teacher","where are we going to have the 48 is the 48 going to be where the 30 is or is it going to be here"
"student","where the 30 is"
"teacher","so i think what student r means by the answer is that our final answer is gonna to be here somewhere so can someone add onto what student k started with us she started by doing three times ten equals 30 i m not seeing that many hands so my question is what does this three stand for"
"multiple students","crosstalk"
"teacher","what does three groups stand for"
"multiple students","crosstalk"
"teacher","student r"
"student","inaudible students in a group"
"teacher","yep the three students in the group what does this ten stand for student a"
"student","inaudible"
"teacher","and what does the 30 stand for student c"
"student","the equation"
"teacher","but what is the 30 telling us can we keep our hands off the cubes please now that s two times i ve asked what is the 30 representing 3 times 10 equals 30"
"student","ten"
"teacher","well it s a multiple of ten yeah so it came from three times ten what does 30 represent student b"
"student","the students"
"teacher","it represents the students so this first equation that student k gave us is telling us 30 students so far so here s our three students in each group the ten is the number of groups so there are those students in that number of groups and we have 30 students taken care of are we done with the problem"
"multiple students","no"
"teacher","how many more students do we have to figure out where they go"
"student","18"
"teacher","how many more students are we still dealing with"
"student","18"
"teacher","18 more how do you know it s 18 more"
"student","inaudible"
"teacher","i can t hear you i m sorry"
"student","inaudible"
"teacher","so you re taking the 30 students out of this 48 so we need 18 more students going off of what student k started us with three times ten how do we get to 18 now we know that there needs to be three students in a group how are we going to get to the 18 think about your facts how are we going to get to 18 we know that there are 18 students we still have left we know that there has to be three students in a group so how are we going to get to 18 how many threes are going to get us to 18 student a"
"student","six"
"teacher","so how do we write that following student k s model what do i write"
"student","inaudible time six equals inaudible"
"teacher","student r mentioned something about our answer being there where is our answer student w i need your eyes up here student s where is our answer"
"student","if you add the inaudible"
"teacher","if we add the three eights where are the three eights"
"student","where it says three inaudible is three times"
"teacher","i don t see counting by threes eight times up here i see 3 times 10 equals 30 and i see 3 times 6 equals 18 where do we find our answer i know we ve been working on this for a while boys and girls but i need your eyes up here where do we find our answer student r said it will be there long pause"
"teacher","i m calling on the same kids because we don t have 100 percent participation here where is our answer"
"student","inaudible the 18"
"teacher","what does the 30 and the 18 equal"
"multiple students","48"
"teacher","is that the answer to our problem"
"multiple students","yes"
"multiple students","no"
"teacher","so your question again is how many groups will there be are there going to be 48 groups yes or no"
"multiple students","yes"
"multiple students","no"
"teacher","what s the 48 representing student v relax laughter what does the 48 represent student a what does the 48 represent in our problem"
"student","students"
"teacher","this is the students so there are a total of 48 students where s our answer how many groups are we gonna need student k eyes up here student f"
"student","the 30 and the 18"
"teacher","so that was our 48 students is that our answer"
"student","no"
"teacher","so our problem is 48 divided by 3 equals blank the 48 are the 48 students student k did a nice job starting us off with a three by ten that was 30 students then we had 3 times 6 to get us 18 more students student r can you tell us where the answer is"
"student","in the middle"
"teacher","in the middle how do we know student v that that is our answer"
"student","cause inaudible"
"teacher","why doesn t the three change what does this three represent"
"student","cause inaudible should be inaudible"
"teacher","shh"
"student","inaudible the inaudible by the inaudible"
"teacher","what s the three"
"multiple students","students"
"teacher","three students"
"student","in each group"
"teacher","yes three students in each group and student v i like that you said that three didn t change so yeah that s representing the students in the groups so what is the final answer it s in the middle what is the final answer how many groups are we going to need student l"
"student","16 groups"
"teacher","we re going to need 16 groups here so we could have written 3 times 16 is equal to 48 student s"
"student","inaudible"
"teacher","30 plus 14 where is the 14 up here you mean that it s a completely different strategy that you use"
"student","yeah"
"teacher","okay so i ll have to look did you do that on your paper cause we don t have enough time to go over another way to do it right now so 48 divided by 3 is equal to what 48 divided by 3 equals what student d"
"student","inaudible"
"teacher","student r"
"student","you said inaudible divided"
"teacher","48 divided by 3"
"student","48 divided by 3"
"teacher","student d"
"student","16"
"teacher","it is 16 so the number of groups we need is 16 so our big array would have been a three by sixteen right"
"multiple students","yes"
"teacher","so there would have been three cubes in every single group because there were three kids in each group but student k made a nice big jump she said let s start off with a three by ten and then that leaves us with just a three by six so even though we re moving into division that big array small array idea is coming back and it s gonna help you solve these division problems so we can write this as 48 divided by 3 is equal to 16 groups of students we can also say that 3 times 16 is equal to what"
"multiple students","48"
"teacher","plus what"
"student","plus three times ten and three times six"
"teacher","and that s not the only way that it could have broken down student d i just heard you say that yours was different this is not the only way to do it i like that we started with the three times ten because you all know your tens you know your time tables of tens those are facts that you can say pretty fast and a few of you when i met with you we talked about that and i think it was for numbers three student c i think that s when i was talking to you about when you broke it down into a multiple of ten first and actually you too for number three you also broke it down into the tens so that s a fact to go to so you don t have to be counting by threes every single time you could have can i break this up you could have taken three cubes and just have kept going until you got to your 48 but i want you to start taking larger jumps last year third grade you counted by threes until you got to whatever you needed to this year you don t need to you can move beyond that taking a huge jump you know 3 times 10 is 30 so that s ten of these right away that you don t need to have in front of you any questions you have about number one student s any questions"
"student","can you do inaudible about inaudible way could ve you have them inaudible plus"
"teacher","like repeated addition"
"student","yeah"
"teacher","like doing the same number and adding it up again and again and again and again"
"student","well you could have the inaudible of ten and then add the eight"
"teacher","so if we re thinking about addition if you re thinking about adding tens and then an eight you have to connect that back to the problem is that going to help us get three groups or three students in our group if we re adding tens so cause one group would be three students another group would be three so just think about that go back to the problem and see if it makes sense with the problem are we okay with this"
"multiple students","yes"
"teacher","so this idea is going to connect to what we re doing tomorrow i know you all did not finish all four problems and that s fine tomorrow we re gonna continue and we re gonna talk about what happens when we have leftovers so we re solving a problem like this but then we have some leftovers not tomorrow monday i m sorry what s gonna happen when we do have leftovers we need to clean up get all of our cubes and everything back into place"
