"speaker","cleaned_text"
"teacher","we ve been working on adding decimals together now we re who can read at the top what the name of the game is"
"student","decimal double compare"
"teacher","decimal double compare this is gonna be your recording sheet i m gonna play with student r quickly on the board so you know how to play student r and i actually i ll play with student i right here because she s sitting right next to me student i are gonna get set a and set b like you ve seen before everybody this looks familiar you re gonna take them out and mix them up set a has tenths and hundredths set b has thousandths you re gonna mix them up and then put them in a pile mix them up really good so that all the hundredth and thousandths are all mixed together so we mixed them up and we were putting them in one pile we re going to share one pile student i s going to flip over two cards i m gonna flip over two cards so can you flip two cards over what are your two cards"
"student","inaudible"
"teacher","so here s student i she has 825 1000 and 8 10 there s a circle in the middle i m gonna flip over two cards can you read my cards for me"
"student","inaudible"
"teacher","your job is to see who s pair of cards is larger so let s add student i s cards together and let s add my cards together can you come up and add your cards together you guys be doing it in your head at your seats student e can you go up and add my cards together"
"student","inaudible"
"teacher","sure good whose pair of cards are bigger student j"
"student","student i s cards"
"teacher","how do you know"
"student","because when she was adding them up she like like the answer inaudible"
"student","she has one whole and 625 1000 and yours are only 85 100 inaudible"
"teacher","can someone repeat what she said go ahead"
"student","inaudible"
"teacher","this number this sum is larger because it s over a whole and this sum is smaller because it s less than a whole is that what we re saying good so what symbol would i put in the middle student t can you come and put the symbol in the middle what symbol did you put"
"student","greater than"
"teacher","good job greater than you have on your sheet five different rounds i m sorry four different rounds what i want you to do i m changing the directions just a little bit next to each one i want you to put a little explanation of how you know which sum is larger so i would put a little note on this one and i would say maybe this is larger than one whole and maybe here i d put less than 1 whole some kind of explanation that tells you why you know which one s larger i m gonna give you papers so that you can keep playing cause i know some of you will finish sooner i m gonna give you paper and what you can do is fold the paper in half and put your cards your partner s cards are you putting your cards also on your paper"
"teacher","each of you has a paper you have it right in front of you each of you has a paper in your book and then i m gonna give each of you another piece of white paper can you solve your partners cards and your cards yes you should be solving both of them so you can help each other solve them you can solve them to make sure your partner is right you don t want your partner to cheat right can you pass this out for me quickly who can repeat the directions when you get the bags what are you going to do with the bags"
"student","shuffle them up"
"teacher","shuffle them up then what are you gonna do"
"student","put them in one pile"
"teacher","yes put them in one pile you and your partner are sharing one pile you re gonna work with student a when she comes back in you two are going to work together you have cards gives seating directions and passes out cards who did not get cards you re gonna work with them you can get started right away once you get your cards"
"teacher","you re going to solve both of them and then decide which one s bigger you need a explanation which sum is greater why"
"student","inaudible"
"teacher","i would love it if you re get started shuffle them and put them in a pile please perfect you need to solve both"
"teacher","you re gonna do a triple compare"
"student","i don t know how to do that"
"teacher","instead of having two you have three to tell which one s greatest i ll change the rules for you a little bit let s put in three columns like this so student k s cards student r s cards and student d s cards and then you ll circle which one s greater how about that"
"teacher","what are you supposed to do with your two cards now good what s gonna go over here nice job"
"student","inaudible"
"teacher","this is yours and this is hers so how do you know that hers is bigger"
"student","inaudible"
"teacher","125 what how we say that decimal"
"student","thousandths"
"teacher","125 thousandths good"
"student","inaudible and i have inaudible"
"teacher","so how do you know that hers is larger"
"student","mine is 29 100 and hers is 800 000 1000"
"teacher","29 100 how do we say that"
"student","29 1000 and 800 1000 so jot a little note how you knew did you change them into fractions no"
"teacher","what s the matter"
"student","inaudible the right answer"
"teacher","i see two are these your two sets of cards whose are these cards"
"student","that s mine"
"student","he just put his cards there and inaudible"
"teacher","so he s saying that your sum in incorrect is that what you re saying"
"student","yep"
"teacher","can you solve that over to the side while you re solving his also show your work on the side so i can see your thinking i think that s incorrect still that s why i don t want you to do it in your mind i want you to do it over here so you can show me your thinking can you write this one over here so i can see how you solved it that s not right be careful how about this when you re solving you can put this in between you and then once you get your answers you can take it down and compare decide with your partner which one do you think has a bigger sum let s look at them how do you say this number"
"teacher","inaudible"
"teacher","try again how do you say that 3 digit number what place is it in thousandths so 600 1000 how do you say this do we have any whole numbers how many one 1 20 100 so which one is bigger 600 1000 1 20 100 how do you know start from the right we re not getting the correct answer starting from the left so we ll start from the right"
"teacher","where is that four where are you getting four"
"student","because i had i put 6 plus 700"
"teacher","each one of these has its own place this column is the thousandths this column is the hundredths this column right here is the what"
"student","inaudible"
"teacher","tenths so you added the thousandths together here with the zero and you carried the one so 7 and 7 is"
"student","fourteen"
"teacher","plus one is 15 now what do you have here to add up is there anything over here to the left of the decimal what is it"
"student","inaudible"
"teacher","where you put that there in your answer is there anything there is your so what s your answer"
"student","750"
"teacher","750 what 750 1000 nice job now you can compare whose is bigger"
"student","inaudible"
"teacher","how do you know"
"student","inaudible"
"teacher","his is larger than a whole and yours is smaller than a whole don t forget the decimal point because that number to me says 750 now is says 750 1000 nice job coming"
"student","inaudible"
"teacher","you can find space it s just to jot a note down you re not writing a paragraph you don t need to be anywhere near the door you guys are doing a great job you re on a role after you do this one go back and jot a note down to let me know how you knew this one was greater how are we doing over here you need a little air to wake you up on the first one how would you write which one you knew was bigger"
"student","inaudible"
"teacher","say it again yeah just got a little note down there how are we doing over here good i like your explanation for 1 but 2 how do you know how did you know"
"student","i m doing this one down here and it says inaudible"
"teacher","i know but what directions did i give"
"student","we don t have to do this we just have to"
"teacher","what directions did i give"
"student","you said do the thingy"
"teacher","do what thingy"
"student","that thingy"
"teacher","what directions did i give"
"student","that less than a whole was larger than a whole"
"teacher","what did i say to do next to each one you need to write an explanation you did on 1 that looks fabulous what happened to 2 3 4 so for each one let me explain again maybe you misunderstood"
"student","i know but i was saying since we do that we don t do this one"
"teacher","no"
"student","oh okay"
"teacher","why did i give you white paper"
"student","to continue"
"teacher","right i can give you more white paper cause it looks like you re doing your work on here which is fine you did it for each one so why did i give you this paper to continue the game"
"student","do we have to do 5"
"teacher","i wanted you what directions did i give i said next to each one put an explanation of how you know which one s larger so it looks like you don t have any room i gave another direction what were you supposed to do can everybody freeze and put their hands on their head pencils down what direction did i give on top of the directions that were already there"
"teacher","too much work you re not ready for middle school yet interesting let s look at 3 how do we say this decimal"
"student","inaudible"
"teacher","75 1000 how do we say this one"
"student","65 100"
"teacher","65 100 so let s rethink this one you said this one was larger because it s 75 and this one has 65 what place is this one in"
"student","thousandths"
"teacher","75 1000 65 100 what would 65 100 be in thousandths 650 1000 so now what s bigger 650 1000 or 75 1000 confused this one we said that if i would have put this as thousandths it would look like this do you agree now read this for me"
"student","inaudible"
"teacher","how do you say this number 650"
"student","650 1000"
"teacher","now what does this one say"
"student","75 1000"
"teacher","which one s bigger would you rather have 650 1000 or 75 1000 if i gave you a pizza and split it into pieces would you rather have 650 of them or just 75 of them you must not make pizza"
"student","it s too much money"
"teacher","this looks like 475 to me"
"student","that s hers"
"teacher","this looks like 475 what s it supposed to read now what does it say what place is it in"
"student","thousandths"
"teacher","so put it all together how do you read that"
"student","inaudible"
"teacher","nice job your explanations you said this one is more than a whole less than a whole okay more than a whole less than a whole what about this one you need an explanation how do you know which one s bigger"
"student","the only thing i can think of is this is thousandths and this is wait inaudible"
"teacher","you tell me what do you think we re looking at the last one which one s bigger which one did you say was bigger"
"student","because"
"teacher","you re listening to what she s saying"
"student","inaudible"
"teacher","so why would that make it bigger than this one what do you think"
"student","i don t know"
"teacher","let s look at it"
"student","i still don t know"
"teacher","how do you say this"
"student","1 and 865 1000"
"teacher","and how do you say this can you put them can you put this into thousandths okay does that help you"
"student","inaudible"
"teacher","how do you know"
"student","inaudible"
"teacher","so 825 1000 is bigger than 200 1000 does that make sense if you re confused with the thousandths and hundredths put the hundredths into thousandths and then compare them by doing that does it change the value"
"student","no"
"teacher","because if i wrote it like a fraction now you need to write a little note how you know that this one s bigger put that into thousandths"
"student","i don t know how to write it"
"teacher","one and how do you say that one and 20 100 how would you write it in thousandths one and 200 1000 i m gonna write it as a fraction for you"
"student","what did you just say"
"teacher","20 hundredths is how many thousandths can you help her"
"student","yeah you just add a zero because"
"teacher","we re not adding a zero"
"student","a place value"
"teacher","you re multiplying it by 10"
"student","yes that"
"teacher","what would it look like as a decimal show me what it looks like as a decimal are those the same"
"teacher","they re equivalent if those are equal these are equal so now which one s bigger this or this"
"student","this one"
"teacher","how come one and 200 1000 one and 855 1000 which is bigger how come what about it tell me"
"student","it s bigger than 200"
"teacher","what is"
"student","inaudible"
"teacher","so jot yourself a little note how you know it s bigger what do you mean you explained it to me"
"student","yeah but that s different"
"teacher","okay explain it to me again"
"student","it s different"
"teacher","what do you mean explain to me again how you know this one s bigger"
"student","that s the higher number at the end"
"teacher","what do you mean"
"student","that this is inaudible"
"teacher","maybe you could use a fraction to help you explain that"
"student","this is less and 1000 like this is close to 1000"
"teacher","oh this number closer to the next 1000 on this one i think this one s closer to two crosstalk so 825 over 1000 the 825 is closer to 1000 it s closer to a whole is that what you mean"
"student","just 1000"
"teacher","can i show you what i think you mean if i had 1000 as the denominator what would be a hole"
"student","1000"
"teacher","like that so is that what you mean that that s closer to 1000 than this one so this number is closer to a whole does that make sense"
"teacher","seven is greater than 0 i know what you mean but can you explain it in a way that other people would know what you meant you re saying this seven is bigger than the zero that s how you know that this is larger but it mathematical terms what are you actually saying 70 what"
"student","5 100"
"teacher","yes 70 100 is greater than 5 100 what place is the 7 in"
"student","the hundredths"
"teacher","the 7 what place is the 7 in here"
"student","tenths what place is this zero in"
"teacher","tenths"
"student","is that what you meant just be a little more clear when you explain it"
"teacher","nice job as i was walking around it seems like we re doing great as we add the decimals and we re doing great deciding which one is larger but we re having trouble explaining how we know which one is larger so all your pencils are down you don t have any cards in your hand you re not writing you re looking up here i ll wait three two okay i m gonna give you two examples up here you had the sum of your card student d was what the one we were just talking about 1 70 100 1 5 100 they did a great job deciding which one was larger but they were having a little bit of trouble with the explanation how would i explain well first of all let s decide which one is larger which one do you think is larger"
"student","inaudible i don t know how to say it"
"student","one whole and 70 100"
"teacher","how do you say this one"
"student","one whole and 5 100"
"teacher","nice job which one do you think is larger if you think 1 70 100 is larger raise your hand hands nice and high if you think this one is larger hands down if you think 1 5 100 is larger raise your hand perfect so we all agree now tell me how you know this one s larger yes"
"student","inaudible"
"teacher","you re saying the whole numbers are the same they both have 1 but after 1 and the number one if they were to be on a number line here s 0 here s 1 here s 2 between what and what"
"student","one and two"
"teacher","excellent it comes from somewhere here between the one and the two"
"student","if you look in the tens spot you ll see that there s a 7 and there s a 0 i think everybody should know that 7 is bigger than 0 so like right now you can tell that the one whole is 70 100 is kind of like bigger but then if you look at the hundredths spot inaudible"
"teacher","i liked your first part she said she looked at the 7 and the 0 the 7 in the tens and the 0 in the tens if this was on a number line and i had 10 spaces in between the one and the two so 1 7 10 would come 1 0 10 would be here so this number would come before it anybody else have a different kind of explanation for this how you know which one s bigger can you explain what we talked about how did you know 1 70 100 is bigger"
"student","inaudible"
"teacher","70 hundredths is bigger than 5 100 they re both in the hundreds place i know they re both after 1 70 100 and 5 100 how would you write 70 100 as a fraction let s do 1 70 100 that would be as a decimal can you write 1 5 100 perfect each one is a fraction 1 70 100 1 and 5 100 if the denominators are the same student r what can i compare"
"student","the numerators"
"teacher","i can compare the numerators what comes first 5 or 70"
"student","five"
"teacher","so this one s smaller than this we agree"
"student","inaudible"
"teacher","what do you mean in order"
"student","we did it for inaudible we know that if 1 5 100 was smaller you would put it at the beginning and put the 1 70 100 on the end"
"teacher","very good this would come before this on the number line 1 5 100 would go here and 1 70 100 would go here on a number line if i had it as a fraction it would look like this sometimes i think it helps to put your numbers as a decimal if you re comparing it how many people do that i see some of you that do that okay listen very carefully close your math book put your cards in a neat pile in front of you when you re ready put your thumb up"
"teacher","i m gonna wait 10 more seconds and everybody s thumb should be up"
"teacher","you re gonna now take your stack you have tens hundreds and thousands all mixed in together you might need to do two rows on your desk i want you to hear the directions be ready to repeat the directions you re taking your cards and putting them in order from least to greatest you might have duplicates what is a duplicate two of the same if you do you can put the card on top of the other one or put it aside"
"teacher","what are the directions student l put the cards in order from least to greatest what are the directions student x"
"student","put the cards in order from least to greatest"
"teacher","what are the directions student r"
"student","put the cards in order from least to greatest"
"teacher","what if you have duplicates"
"student","i forgot"
"student","put it on top or tow the side"
"teacher","put it either on top of the other its twin or put it to the side if you have the numbers 0 1 2 or 1 you know where they go"
"teacher","i m going to be walking around as you do it but if you get finished call me and i ll come check it"
"teacher","groups what do you mean groups oh tenths hundredths and thousandths"
"teacher","what number is in the tens spot zero so where are you gonna put it"
"student","so this would go before 1 10"
"teacher","yes why did you put these two here where do these go how come the cards confuse us when i give you problems on the board and problems in your book"
"student","it s easier"
"teacher","how come"
"student","the cards have words they get you confused"
"teacher","the words are confusing pay no attention to the words"
"teacher","find 1 10 which would come first 1 10 is how many hundredths if was counting and this was a 10 a zero here 10 15 20 30 40 50"
"teacher","not now after we go i see a lot of cards on the floor this one here you have 15 100 and 125 1000 what would 15 100 be as thousandths"
"student","150"
"teacher","so what s bigger 150 1000 or 125 1000"
"student","inaudible"
"teacher","nice job"
"teacher","these look great where are you putting these after this are they going to in between put them where they go"
"teacher","i m confused is this a number line okay it goes like this nice job what about this one"
"teacher","nice job is that all your cards"
"student","inaudible i change them to thousandths in my head and inaudible"
"teacher","150 what thousandths nice job thousandths nice job"
"teacher","okay a is gonna be tenths and hundredths and b is gonna be thousandths you guys are doing a fabulous job ordering them but we re running out of time i need one partner to take all the tenths and hundredths and put them in a i need the other partner to take all the thousandths and put them in b and i need all the baggies and it should not take you more than one minute"
"teacher","on friday we were talking about the bicycle race game and we were solving problems using fraction bars and writing equations for these problems so we re gonna continue to do the same thing now page c26 and another bicycle race read what it says for me student x"
"student","use the fraction bars to show your inaudible in each problem inaudible"
"teacher","so you re doing two things what s the first thing you re doing student s"
"student","writing an equation"
"teacher","writing an equation what s another thing you re doing yes"
"student","showing your solution on the fraction bar"
"teacher","showing your solution on the fraction bar read number one for me student e"
"student","inaudible laura has inaudible half of the race how many miles has she gone the super bicycle race is 100 5 long"
"teacher","notice how she went back she read number one but then she looked and saw information that she missed so she went back make sure you don t miss that information it s important what information does it tell us student a"
"student","that the race is 120"
"teacher","yeah how long the race is so on number one it s asking you what s an equation we can write for number 1 guess"
"student","we have inaudible"
"teacher","or one half times 120 good write the equation and solve it quickly"
"student","next to the fraction bar"
"teacher","anywhere you can did you get a fraction bar okay see if you can represent it on the fraction bar if you solved it quit talking you need to be on the right page i need to you stay with me nice job labels nice job now see if you can show it on there where s your answer to that nice job ah not a fraction"
"teacher","nice job solve it come on"
"student","i can t"
"teacher","nice job now just put it in the fraction bar nice job what s happening when inaudible"
"student","um"
"teacher","okay you need to inaudible fraction bar nice job you guys are superstars with this good alright 1 half times 120 is what"
"student","60"
"teacher","student t"
"student","60"
"teacher","60 here s my equation now i wanna put it in my fraction bar student s"
"student","just draw half of a circle"
"teacher","a circle i have a fraction bar here"
"student","oh then do then do it shade in half"
"teacher","and what is the half gonna represent"
"student","60"
"teacher","60 what"
"student","miles"
"teacher","so if she bikes 60 miles how many more miles does she have to go"
"student","60"
"teacher","how do you know"
"student","because it s half of 120"
"teacher","nice job"
"student","and half of 120 is 60"
"teacher","i know it is nice job go on to number 2 yes come on wake up sit up nice job student m now do this one"
"teacher","oh inaudible what do you have what did you break those into okay i like inaudible where is your equation you need an equation and a representation"
"student","how would i write that"
"teacher","um how would you write it what s it asking for"
"student","at the end of inaudible 1 fourth of the inaudible how many miles did she go"
"teacher","how did you do this one"
"student","inaudible"
"teacher","okay but he s not going a half here how mm hmm so how would you write it nice job"
"student","woo woo woo woo continues"
"teacher","what does this represent"
"student","um i don t know"
"teacher","why do you have okay usually this is okay but usually when we re talking about taking this inaudible from start start in the middle if you re using that but you re right it does make a difference where you shade it you re right inaudible where did you put them okay if i checked yours you can go on to number 3 yes"
"teacher","1 4th right"
"student","yep"
"teacher","good you have the same thing as student k you re right it doesn t matter where you shade it in when you re talking about a race this is the beginning of the race and this is the end"
"student","inaudible"
"teacher","no this okay nice job you re on a roll"
"teacher","okay where is this 60 coming from where should it be"
"student","inaudible"
"teacher","yes"
"student","um i think it goes in the back cause it s"
"teacher","this is how it s done what s the total for the race so at the end of day two you just told me that you went 10 miles 100 inaudible no this is the you told me this is the ending point"
"student","not for you i didn t say you"
"teacher","right"
"student","oh"
"teacher","it s just saying that this is representing what is completed so far excuse me i m very sorry you need to rethink your thinking 1 4th times 120 can you do that okay so which is inaudible student m this is the last time i m gonna ask you to stop your name is gonna go on the sheet okay but each one of these you re telling me is 100 miles"
"student","i said"
"teacher","1 2 3 4 5 600 miles but what s the total of the race"
"teacher","okay this one takes a little bit of finesse what s the denominator here i m sorry inaudible one what is it here so 1 2 3 4 5 have to add up to what you told me you went 100 miles 5 has to equal 100 so what s it going to be what do you have"
"student","inaudible"
"teacher","guess make a guess alright i wanna draw your attention to number 3 read it for me student s"
"student","at the end the day inaudible how many miles did he go"
"teacher","i need an equation for number 3 and equation for number 3 yes student k"
"student","there s a half plus 1 4th"
"teacher","i need an equation"
"student","1 3 4 3rds inaudible"
