speaker,cleaned_text
student,teacher
teacher,yes
student,a is not inaudible
teacher,you can fit nine of a
student,eight or nine inaudible
teacher,right eight times nine but the trouble is you have wasted space in a don t you because there s no way to fit two high on these if we put two high it becomes too high in the package all right some of you have already started and gone to page 19 nineteen is asking you to find some volume of some numbers and a few people went early and started building some boxes for them i know we need to get some more centimeter grid paper but if you want to build some of these boxes out of the cubes you can do that i see that student c did
student,inaudible cubes
teacher,so
student,six by four which
teacher,find the volume of each one
student,so what am i supposed to do
teacher,you re done i think
student,i m done cause i did page 19 inaudible
student,inaudible
student,did you do two of them
student,inaudible
teacher,did you finish did you finish the other thing oh okay from the other day okay i was trying to see if they were all correct okay okay great
student,so i m done
teacher,yeah okay boys and girls let s clean up
student,page 18 is inaudible
teacher,yes you re gonna take home page 18 for homework
student,i already did it
teacher,you can just put the cubes in the containers they don t have to be broken up if you don t want to
student,i do
