speaker,cleaned_text
teacher,and working at their desks as a group can i have student a student b and student m student n and student j
teacher,okay you guys can sit in this area right here okay student a can you come over and sit next to student b student j bring your things to come work over here sit in between student m and student n student f you re with me on the rug
student,there s three eighths
teacher,that s fine okay you guys are ready i see you have your equivalent fraction chart that will be very handy okay student f bring your workbook and pencil and join me on the rug yes
student,inaudible
teacher,i know student s and can we share our workbook page so that she can see and work with you please
student,inaudible
teacher,yes and if there s one other person in the group that wants one there s two there okay you guys ready my group over here you got some grids if you need your grids and student b are you sharing your workbook with student s you guys are gonna share so she can
student,inaudible the denominator
teacher,remember that was our big no no no
student,inaudible
teacher,that s the one that we just did together on the board remember we just talked about that one
student,inaudible
teacher,talk to your partners see what they think we just did that tog
teacher,all right okay hold off so student a make sure you have a place to sit student j
teacher,student j sitting in a chair i can t start my group till i see people are sitting down student b student b you re over here come on
student,i m coming
teacher,well then come and sit quickly we shouldn t have to wait
student,inaudible
teacher,that s a good question to ask your group who can help student c
teacher,sit down you need your workbook open to the right page you got it ready student f
student,yeah right here
teacher,okay so we have some grids to work with just in case so let s look can we flip to the first page for a moment okay so student s let s be right on page 19
student,inaudible
teacher,we didn t right so let s review number one though it s always good to go over it right and you can help me explain since you took a look at that already
student,do we need this
teacher,you need your workbook yes we might want our grids to help us i have some grids here too and we might use your markers okay
student,inaudible
teacher,okay inaudible page 19 unit 6 okay student j sitting in your chair thank you what we re gonna talk about you can help explain it so number one student f will you read one for us
student,alexa ate one eighth of a sandwich dwayne ate another eighth of a sandwich the same sandwich sarah ate of the same sandwich how much of the sandwich alexa dwayne and sarah eat altogether
teacher,okay so they re all eating and sharing the same sandwich right
student,yes
teacher,okay so let s you know we like to make representations let s have our sandwich this long box is my sandwich so let s start with what we know we know three people eat it right alexa and who else
student,dwayne
teacher,dwayne
student,and sarah
teacher,and sarah how much did alexa eat student c
student,alexa ate one eighth
teacher,one eighth and dwayne ate what student c
student,the same
teacher,so an eighth again and did sarah eat
student,one fourth
teacher,one fourth now student s so alexa and dwayne both ate an eighth and sarah at a fourth which of these people ate the biggest part of the sandwich
student,sarah
teacher,that s your opinion let s ask student s
student,sarah
teacher,why do you think sarah ate the most she ate a fourth that s bigger than an eighth how do you know
student,cause when you cut a sandwich and you cut it in an eighth it s small
teacher,eight pieces instead of cutting it in four that would be smaller okay how can i cut my sandwich and start figuring out what they ate do you want to make the first cut on my sandwich here let s figure this out
teacher,what s that
student,i don t know he didn t finish
teacher,maybe we don t want to start there where do we want to start we re gonna try and make eighths and fourths right think about when you normally attack a 4x6 grid and you re trying to start breaking into fourths so what s the first move you usually make
student,inaudible
teacher,okay
student,a 4x6 there s a column
teacher,there s a column okay there will be four columns so we don t have columns here we just have a sandwich student s what do you think we should start doing
student,cut it in half
teacher,cut it in half
student,right like that
teacher,okay cut it in half and then what
student,the other side
teacher,and cut it in half the other way
student,yes
teacher,okay let s try that what did we just make student f
student,fourths
teacher,fourths and then what will we do
student,use brown
teacher,what s student f doing student c what did he just do
student,he cut it in half again
teacher,half and half and he made fourths so he just colored in who ate this he colored that in who ate that one
student,sarah
teacher,okay so now we have sarah on there that s what sarah ate student s did you figure out what dwayne and alexa ate we have fourths on our sandwich and we re trying to figure out they each ate one eighth what s that gonna look like i know student s knows right
student,she ate a big half
teacher,she ate the biggest piece how are we gonna make eighths if we have fourths on here student b and student d what do you guys think she s trying to turn her fourths into eighths she wants to find eighths how are we gonna get eighths student d
student,i know i know
student,turn that into an eighth
teacher,how how would you do it
student,okay inaudible
teacher,can you explain show student s how to make this eighths get your finger over and show us how to do it what do we do
student,put a line here
teacher,no wait this is a sandwich should we go across or should we just make straight lines cause we re like cutting the sandwich
student,just go straight like that
teacher,so break the fourths in half right
student,yeah so it can be even
teacher,a little bit make it even cut it in half right in the middle in the middle there okay and what do we think student c student s what do we think student d said to cut that fourth in half
student,inaudible
teacher,so student d cut this in half student c and student s what do you think did we make eighths if you cut that fourth in half
student,no
student,he made a mistake
teacher,so what if we look at the lines like this if we make it into the same size pieces one two three four five six seven eight do we have eighths
student,yes
teacher,we have eighths now right so we made eighths and one two three four five six seven eight right eight equal pieces how many eighths were inside that fourth that sarah ate
student,two
teacher,two eighths that s one of those equivalent fractions we know right two eighths is one fourth equal can you color in what dwayne and alexa ate shade that in for us student s are you shading in your representation so we have the sandwich
student,yes
teacher,and you have yours i see six on your sandwich i don t see equal pieces
student,inaudible
teacher,all right you don t want to press too hard on that marker there
student,my sandwich is too inaudible i didn t do it like that
teacher,student c how much student b look at this sandwich here look at our picture we have a fourth plus and eighth and an eighth all together and it says all together how much of the sandwich did they eat if we add this fourth plus an eighth plus an eighth how much of the sandwich is that
student,half
teacher,how do you know it s half student c
student,i don t know i know because
teacher,why
student,all of these equal half
teacher,how do you know that the colored in part equals half
student,because it s half of the half
teacher,half of the whole or
student,no
teacher,how do we know that it s exactly half student f how do i know it s equal
student,cause if the half line is right here
teacher,and how do i know that s the half line are there equal amount of pieces on both sides
student,yeah
teacher,how many are on this side
student,four
teacher,four what these are
student,four sandwiches
teacher,no one whole sandwich
student,four pieces
teacher,four pieces what s the fraction
student,four eighths
teacher,four eighths and we know four eighths is half
student,yeah
teacher,so student s if i ate one two three four right four eighths i ate half how much of the sandwich is left what fraction
student,inaudible
teacher,and that s equal to
student,a whole
teacher,four eighths equals a whole i see you shaking your head what did you mean to say four eighths equals what
student,no a half
teacher,a half right four out of eight pieces is half eight halves so half is left right
student,and it s also equal to two fourths
teacher,it would be equal to two fourths cause that s half right because if this is a whole fourth and that s a whole fourth and that a whole fourth that s two fourths you re right all right let s check out number two does anybody have a tissue that i can erase with student s what a perfect helper thank you you so are so prepared to be in this math group okay number two student c were you do you want to read student s go ahead read number two
student,russell has 24 students in class three eighths of those students went inaudible one fourth went to the library inaudible was out of the classroom
teacher,out of the classroom so we have a class of 24 students right and we have to figure out fractions of them
student,it says the answer right now
student,inaudible
teacher,well those are the fractions
student,it says what fraction of students
teacher,was out of the classroom so three eighths of them were at recess and one fourth were in the library excuse me student b
student,inaudible not doing this
teacher,student d is not doing this problem so why are you getting a lesson from him over there we re doing this together so if have 24 student three eighths of them are at recess and one fourth are in the library so those two groups are out of the classroom right and they re asking us what fraction is out of the classroom all together
student,we ve got to add it
teacher,we re gonna have to add some fractions here i am gonna check in on some other groups but you guys i want you to think either making a representation or using your 4x6 grid right a 4x6 grid has 24 pieces
student,yeah
teacher,you can use that to try and model some of these fractions on the grid but you guys are here to help each other do this together i m gonna check in on another group but i will be right back
student,is three eighths a half
teacher,wait think about our sandwich we said four eighths was half right so three eighths would be less than half right
student,i looked at the page wrong it s not on page 22 it s on page 23
teacher,oh thank you you guys are on to a 10x10 grid
student,yeah
teacher,well let me check out and see how it s going tell me what you have been working on
student,these are inaudible
teacher,okay let me check in with them and let me see what you re doing hmm
student,inaudible
teacher,that means we re writing too hard on it then
student,inaudible
teacher,so flip back show me some of your work
student,inaudible
student,no she means go back to
teacher,where s your answers
student,inaudible
teacher,this is two fourths does that tell me the number of students that s a fraction
student,i did it
teacher,so here it said what fraction right
student,yeah
teacher,and now they re asking you how many students that s the number of people
student,so two fourths
teacher,two fourths of 24
student,inaudible is 12
teacher,how do you know
student,because 12 plus 12 equals 24
teacher,how did you know that two fourths was gonna get you
student,because i know that one fourth is 12 so then if i do another one that s gonna give me 24 no wait
teacher,think about what you just said and tell me when you re ready
student,each fourth is six
teacher,each fourth is a sixth and you have two fourths
student,so then the answer is 12
teacher,okay
student,because if you have four fourths
teacher,excuse me student n from over here i can tell that s not a math conversation
student,it is 12 because i did it right here teacher because i know that four fourths is 24 and i knew that inaudible is 12 like you said then eight fours can t be 12 inaudible
student,can i get a water
teacher,you can if we take a look at your work here
teacher,wow how did you get twelfths here when you re adding fourths eighths and fourths how did you get twelfths
student,one whole
teacher,how many eighths is one fourth equivalent to
student,huh
teacher,how many eighths is one fourth equivalent to
student,two
teacher,two eighths so that s like having two eighths plus three eighths plus two eighths how many eighths are we going to end up with there
student,first let s figure out two eighths and two eighths
teacher,what s two eighths and two eighths
student,four sixteenths
teacher,do we add denominators
student,no
student,four eighths
teacher,so two eighths plus two eighths is four eighths and that s equal to what
student,inaudible
teacher,four eighths is equal to three eighths
student,no
teacher,can we add four eighths and three eighths
student,yeah it will give one whole and a half
teacher,four eighths plus three eighths
student,yeah because
teacher,write that down and add that four eighths plus three eighths
student,four eighths plus three this is on my grid
teacher,do we need a grid to add that
student,no
teacher,can you tell me
student,seven seven eighths
teacher,so student r is that gonna be more than one whole
student,no
teacher,no it s getting close isn t it though
teacher,if we agree that one fourth is two eighths right and we agree we have a representation to prove it so that s like two eighths plus three eighths that s five eighths plus another two eighths is seven eighths how are you getting twelfths though i m curious
student,i was doing it by twelves that s why
teacher,how did you make three eighths into twelfths did you use a grid it s possible that we could
student,yeah
teacher,show me your grid now when we re making eighths and you re trying to make a lot of fractions
student,i labeled it
teacher,can i see your pen it s gonna be a lot easier to do our eighths like this rather than splitting it like that and having awkward rectangles
student,yeah that s what
teacher,it s easier to make your three like that
student,inaudible
teacher,right it s hard when you use the triangles so you can start using the groups of three like that so you have three eighths so let s look at that so three eighths is like this amount here how many tiles are gonna be a twelfth if our whole is 24
student,how many wholes are in there
teacher,how many number of tiles if we re breaking it into twelfths and our whole is 24
student,times two
teacher,so we will have two in each if i m making twelfths twelve equal groups that would be two in each
student,yeah
teacher,so that s one group that s two groups
student,half is six
teacher,three groups
student,four groups
student,can i tell student r what to do
teacher,we can t really find an equivalent fraction for
student,oh yeah yes you can
teacher,well that s going outside of our three eighths
teacher,so can t really make those equivalent
student,yeah because inaudible we can go that we can do that and then we can do this one
teacher,we can make a whole into twelfths
student,yeah
teacher,we could but it s tough to make those eighths into twelfths it didn t really fit right we had one left over instead of two so we couldn t really make twelfths either
student,what about a remainder
teacher,it s like having a remainder with division so it s not a perfect equal group then right and fractions have to have equal groups
student,can i tell student r inaudible
teacher,yes about equal in fractions or what what do you mean times two
student,remember when you showed me they have two different denominators inaudible times two
teacher,oh yeah you can talk about that yeah student m go ahead
student,i don t really get that
teacher,this that was a page from homework the other day
student,is this right
student,is this right
teacher,a half plus where s the half
student,right there
teacher,this part here
student,mm hmm
teacher,i see 10 tiles in there and the whole is 24 is 10 half of 24
student,no
teacher,what s half of 24
student,twelve
teacher,half of 24 if i cut it in 2
student,inaudible
teacher,half of 24 half of 24 one out of 2 pieces
teacher,if you re being silly she can t think
student,i m not being silly i m telling her
teacher,well let s see well it s here i see half half means having two equal pieces right so if we have two equal pieces then our whole is 24 i m splitting it into two equal groups right to make half how many pieces will be in each one
student,half
teacher,half but how many tiles
student,twelve
teacher,yes 12 right cause 12 and 12 will be our 24 so if that what you colored in was meant to be half i shouldn t see 10 i should see 12 right
student,so i need to color two more in
teacher,mm hmm
teacher,you re not getting the work done over there
student,i don t know what to do
teacher,okay
student,i got that out i got it
teacher,you got it you guys worked together
student,yeah
teacher,okay can you work and explain
student,no he doesn t
teacher,student d are you ready for some help
student,everybody s helping me so i m almost done
teacher,but student d would you like some help
student,no
teacher,you don t want to work with a partner
student,no
teacher,well i see you re making
student,inaudible
teacher,okay i see you ve made some eighths there and i see three eighths so i know you ve gotten started
student,that s right
teacher,that looks good so far
student,i know
teacher,all right what problem are you on
student,i don t know i did them not in order
teacher,okay
student,inaudible
teacher,well this one one third plus two thirds
student,one third plus two thirds inaudible
teacher,yeah and three thirds is equal to what
student,to one wait
teacher,three out of three pieces
student,one whole
teacher,it s a whole and then we have this other piece here the half can we add a
student,one and one half
student,can i go use a piece of paper
teacher,you can but i m gonna call the group back together you know what excuse me
student,huh
teacher,excuse me put all of these in here why are you walking around and this is in your mouth is that fourth grade behavior
student,i didn t have them in my mouth
student,yes you did
teacher,okay well i can check this later and replay what you just did did you have it in your mouth
student,i was trying to get the ink so it could work
teacher,this doesn t look like appropriate math work to me
student,it was in unit 7
teacher,wrong page
student,yeah wrong page this is inaudible
teacher,student d did you help make sure student m is on the right page
student,yeah he said inaudible
teacher,okay we ve got to come back together sweetheart can you tell him to get his things and come back to his seat
student,okay but he missed inaudible
teacher,can you help him
student,he was in unit 7
teacher,no he was on unit 6 sweetheart he was doing the same problem you were doing he s okay
teacher,okay i need your attention inaudible one thank you student d student b i m here okay make your way back to the desk you were in so that we can go over one of the problems together please
student,can i do this one on the board this one
teacher,well we re gonna chat about some of the ones on this page girls that means now pick up your things student j and student c are already in their seats but student b student k student k pick up your belongings come to your desks
student,inaudible
teacher,yes if you were in the group on the floor with me come to your desk can you back your desk up please quickly student j
teacher,pick up all of your belongings pick up all of your belongings please you said you brought markers pick them up
teacher,back to you seat quickly please shh back to your seat that way clearly you can t get through that way you re wasting your time
student,inaudible our regular seats
teacher,nope right where you were before we re almost done
teacher,you know what i have one two three four people that don t have permission to get water out of their desk
teacher,you guys have lost four minutes you re on your way to five six seven eight
teacher,the longer it takes people to get ready to share their work student s we re over here okay we re done with that you didn t have permission to use this marker these are my things
student,student o used it
teacher,you know what it s a little disappointing when i can see that people have been using my supplies a variety of them without asking
student,inaudible
teacher,this is a waste of our time all right we re ready to go over some of this that means your pencils are down and your eyes are up most people are ready i m waiting for a few people to take a seat
teacher,most of the class is ready there s three people that are ruining it for the group
student,inaudible the computer
teacher,that was not my computer i will find out what that was later
student,it sounded inaudible
teacher,so student o you have a huge mess you clean that up please i see milk on the floor from breakfast that should have been thrown away this morning
student,okay
teacher,okay so you guys most of you made your way through the problems some of you even started to look at some 10x10s if we look at this word problem here i just want to think about word problems cause we have some of these for homework we re finding a fraction of a group we can still use grids to help us but we can also think about division right to help us with our fractions
student,i thought that timetables would go away with fractions
teacher,timetables knowing multiplication can help you because sometimes we have to use division with fraction multiplication and division facts will help us with that but if we look at this problem would you read it for me student s
student,which one
teacher,the number nine leon
student,leon bought a big pack of marbles one third of them are blue one sixth of them are red the rest are yellow what fractions of the marbles is yellow
teacher,how am i gonna know what fraction is gonna be yellow i know blue i know red what are we gonna do here
student,inaudible
teacher,student j
student,you make a square inaudible marble
teacher,so this is my whole group of marbles then what
student,and then you make six
teacher,you want me to make six
student,a third a third first
teacher,how do i make thirds just make
student,go down half and then you make a line inaudible
teacher,down the middle or in different places
student,different like this like there are gonna be two right there and then that one is just gonna be
teacher,okay so i m gonna make two horizontal lines
student,no
teacher,what s student j trying to do
student,make the inaudible like this then that s a third
teacher,that s a third what do you guys think is that a third what student j made there
multiple students,no
teacher,what did he make
student,he made four twelves
teacher,cause if i had a line here that would be four equal pieces that s actually a fourth
student,that s not a fourth
teacher,let s see one two three four equal pieces if we
student,after you just drew that line
teacher,no actually tell student j why is not just cause i drew that line we broke a half in half what do we get when we break a half in half
student,four
teacher,when i break a half in half i end up with two fourths two fourths so you re making that two fourths
student,i wasn t making a fourth i was making a third
teacher,okay well how can we make a third how can we make a third
student,i know
teacher,student r how can i make a third
student,all you do is could you erase it a little
teacher,yes i can okay so we have my box my whole marble
student,just inaudible three lines
teacher,okay as best i can i try to make three equal groups
student,and now you just color in one that one group
teacher,i m gonna color in one one third what does that represent what i shaded in from my word problem student c
student,one third
teacher,one third and what color is that representing
student,blue
teacher,blue okay so this is one third and that s my blue marbles but i know how many are red how many are red
student,one sixth
student,inaudible
teacher,do you want to show me how many are red how would you show how many are red how are you gonna show me one sixth in that same group right cause it s the same whole
student,make a line through inaudible
teacher,make that right
student,teacher he has a oh he had a problem
teacher,you fixed it though
student,yeah
teacher,okay now what oh wait a sec we re talking about red marbles can you use the red marker to show the red marbles that will help everyone oh on top of the blue one can we do that it s a different amount right okay
student,wow better
teacher,is that a sixth what student a did what do you think student did he make a sixth
student,no actually it was six
teacher,well what he shaded in in red is the red part that he shaded in a sixth
multiple students,yes
teacher,okay so this is one sixth and that s our red marbles
student,inaudible
teacher,and the blue is equal to what
student,two sixths
teacher,how do you know
student,cause this is
teacher,two sixths inside of that inaudible
student,it says right here inaudible
teacher,oh we know one third is equal to two sixths okay we know that equivalent fraction so what fraction of the marbles are yellow how do i know what s yellow student c
student,the ones that are left that are not colored
teacher,the ones that are left so i see one two three part three out of how many student m
student,three sixths are yellow
teacher,so what fraction are yellow student m says yellow equals three sixths and student c three sixths is equivalent to a fraction that we know do you know what it s equivalent to student n do you know what it s equivalent to what
student,half
