speaker,cleaned_text
teacher,i noticed that inaudible keep flip flopping the numbers around i think that we do that because inaudible ninety times three right you can actually do that so you don t get into the habit of doing what inaudible said and say oh this inaudible so we can just add that zero there so they re flipping the numbers around specifically so you really think of what is the process here so what is the relationship between the nine and the ninety
student,the zero and the seven inaudible ninety
teacher,inaudible relationship what is the mathematical relationship between the nine and inaudible
student,nine by nine by ten
teacher,you what
student,you multiply nine by ten
teacher,so the nine times the ten is going to give you the ninety right nine times ten is ninety and how does that relate to the answer
student,it relates to the answer because it equals the inaudible ten
teacher,so ten times
student,twenty seven
teacher,twenty seven so if i did twenty seven times ten i m going to get this answer when i did nine times ten i got ninety so multiplying by multiples of ten understand the inaudible when you re multiplying by a multiple of ten that s our main focus today one last coment student z
student,this is page 42 but like the third one over here i got confused with it because i don t know if it was supposed to be 100 or 48
teacher,can you read us the problem so we go back to what page
student,forty two
teacher,forty two tell me the problem
student,eight times six eighty times six and eight times sixty
student,same thing
teacher,so it looks similar
student,yeah but when i first started it i was confused because i didn t know if i should put like 100 or 48 or inaudible
teacher,oh okay i see let s talk about that what is eight times six
student,forty eight
teacher,forty eight and then student z said wait do i put 148 for my answer or is it 480 so that s the question is it 148 or 480 did you answer this on your own already or is this still confusing you
student,inaudible
teacher,you answered it already which did you choose
student,four hundred and eighty
teacher,four hundred and eighty do you know why
student,yeah because i started because on my work i put like what we were doing like the eight multiply by ten so i would say like 48 i would multiply by 10 and it would give me 480 so
teacher,okay so you thought about that okay knowing you can multiply the answer by ten if i multiply eight by ten am i going to get 148 what do you think student f
student,480
teacher,you think 480
student,mm hmm
teacher,okay and is that also for eight times sixty or is that a different answer
student,it s 480
teacher,it s also 480 is there anything else that would maybe help us to know why it would be inaudible student z was kind of struggling with it he knew those numbers 48 had to be in there somewhere because he wasn t sure where to locate them what place value they held student s
student,do you add inaudible and then if you add another one inaudible
teacher,that s a really good explanation student s said if you start adding 48 s together after you ve got two of them you re almost at 100 so it can t be that low that s two low good estimation skills i like that student s
student,inaudible
teacher,where
student,inaudible because i was going to say something if you like 48 times 10 if you inaudible it s 48 inaudible because in the first one your answer is inaudible
teacher,by ten so once you have those answers you ll know those are all related you know those are related that these answers will all be multiples of sorry that these two answers will be this answer or product multiplied by ten so you re right about that but student z was still kind of confused with how to multiply by ten and how much that would look like right you knew that number it had to be in there but he wasn t sure how to arrange the numbers
student,but i got 480
teacher,so ultimately he got 480 and i like student s s explanation about why it couldn t be a number in the hundreds it s just not enough it s got to be way higher up there because you re multiplying by ten once you multiply by three you re already into the hundreds right you still need to multiply by inaudible good point any last questions about this so if you weren t able to get to the next page 48
student,i was
teacher,is more story problems about tens so it s related to what we just did in class if you finish it fantastic we ll go over it tomorrow if not add that to your homework list okay you can pack up your math and get ready for art
