speaker,cleaned_text
teacher,okay let s get started here just put your scissors down you don t need them right now who can tell me what i m holding student n
student,a little small cube
teacher,a small cube it s smaller than the cubes that we ve been using we ve been using cubic inches this happens to be a cubic centimeter and what we are going to do today is determine how many of these cubic centimeters will fit into this box and you ll be getting the pattern and creating the pattern now we don t have enough cubes for each one of you to take all of these cubes and put them in here and put them in so what you are going to want to do is come up with a strategy to determine how many of these cubes will fit in this box you will get a pattern you will get a bag of cubes i ll put some cubes on your desk and you will also get a ruler on one side of the ruler you ll see the measurement for inches and on the other side of the ruler you ll see the measurement for centimeters which type of measurement is greater centimeters or inches
student,centimeters
teacher,centimeters or inches
student,no actually
teacher,yes because the centimeters is smaller than an inch a centimeter is half of an inches and we know that 12 inches equals student r
student,one foot
teacher,one foot so today what we are going to do is take you are going to get a box pattern and we are going to determine how many cubes fit into the box and that will help us determine what i have these cubes i need to find out how many cubes will fit in this box once i do i think know the answer for what student l
student,the volume
teacher,the volume and what does the volume tell us i don t want you to tell me now i want you to think on this as we work on this paper passers please i need all paper passers to come on up here give everybody a ruler hmm yes you can work as a group to determine how you are going to find out how many cubes fit in the box you are going to cut out the cubes cut out the pattern and on the solid line is where you are going to be folding first cut out the pattern first cut out the pattern and then i ll come around and give you tape you can actually work as a group or if you and someone on your team want to go off and work as a pair that s fine too i gave you cubes so go ahead and cut out the pattern open up your math notebook and what i would like for you to do yes
student,was i supposed to give the rulers to student b
teacher,yes everybody needs a ruler did you have enough no then if you didn t have enough who did not get a ruler okay student g can you give student j a ruler and student a you can use the ruler if you want or you can use the cubes
student,i have two rulers
teacher,we re using the rulers that are in front of you is that you got it student d remember you are cutting little pieces from your tape this is the tape that you get you just cut little pieces to close your pattern no so boys and girls look up here for a second you are only cutting the dotted lines so the solid lines is where you are folding to create your box so if you look up here this is what it looks like i didn t close it just in case i need to put things in you are not to fill it up you need to decide how you are going to determine how many cubic centimeters fit in this box and you are thinking about how you are going to determine how many fit in are you talking about how you are going to determine i need you also just so you know i need you to really speak up as you are talking about this is the only time i don t want to say scream but i want you to talk make sure you are very clear when you are talking about your strategy and how to determine
student,ms f i got my inaudible
teacher,you can go and get your math notebook are we talking about math student a or are we talking about something else okay
student,do we fill the blocks so that the lines
teacher,yeah i said that it doesn t matter how you fold the box because there are no lines last time when we would fold boxes we had lines which you need to help you determine the dimensions but because there are no dimensions showing we have nothing to tell us what the dimensions are you are now using the cubes or the ruler student a
student,inaudible
teacher,i would rather well you can close it yes if you don t feel like you need to put anything in there that s fine what could you use rather than using and putting cubes on the inside what could you use student m
student,inaudible
teacher,so you think you could use the ruler to measure the dimensions and what else could you use that s on your desk what else did i give you student l
student,the cubes
teacher,the cubes the centimeter cubes so at this time you should be finished up making up the actual box you did not get tape i m sorry so i see some of you using the ruler to measure i see some of you placing the cubes on the inside of your box what are you doing student l
student,i m gonna put cubes around it and then like someone inaudible i m going to multiple this and this and the top
teacher,so you are multiplying three dimensions
student,yeah
teacher,and what are you doing student m
student,just doing the flat surface and then i m just going to put one corner inaudible and see how high does it going and then inaudible take the height times the length and
teacher,and what so you are saying the height
student,times the length and the width
teacher,the width so you are using the three dimensions so you should be i should see you working with your group and discussing your strategy once you have figured it out you are going to write your strategy down in your own words in your math notebook but you are discussing right now how you are going to figure out how many cubic centimeters each edge is what did you do student d what s here
student,the length the width the height
teacher,so show me what you did
student,inaudible
teacher,eight what
student,inaudible
teacher,eight what kind of centimeters
student,cubic centimeters and then i measured here and got five cubic centimeters and then i measured here and got four cubic centimeters
teacher,did you figure it out yet student a
student,inaudible
teacher,you are using the cubs and what are you determining based on from using the cubes so what do you notice
student,that there is inaudible 5 the width
teacher,5 what
student,little cubes
teacher,they are cubes but what do we call them when we are thinking about the length of the cube it s a cube but it s a cubic centimeter and cubic meaning determining the volume but centimeter means that s the type of length it is sometimes we measure in centimeters when things are pretty big we might measuring using inches or feet or yards millimeters tell me
student,what we did first was find how much is the height and then we did
teacher,what do you mean by how much is the height what do you mean by how much is the height
student,like how much centimeter cubes go in it layers
teacher,okay how many layers how many centimeter cubes or cubic centimeters those two different ways of saying it okay you looked at the height for what
student,for cubed centimeters
teacher,okay
student,then we figured out the length
teacher,and what was the length
student,it like was five
teacher,five what
student,five cubic centimeters and we figured out the width and it was seven cubic centimeters
teacher,okay and that s who you determine the dimensions and then how did you determine how many of these cubes how many cubic centimeters fit into that box
student,well we multiplied
teacher,where is your work
student,we are going to do it right now
teacher,yeah and make sure you write down what you did did you do it did you find it okay tell me what you did student k
student,inaudible
teacher,tell me what you did
student,inaudible
teacher,you did what do you need to fill the whole box no imagine if this box were as big as this room we would be here for years trying to figure this out right
student,so i just put the length times width times height
teacher,and tell me for each dimension what did you get
student,i got 8 by
teacher,8 what
student,8 cubic centimeters by 5 cubic centimeters by 4 cubic centimeters
teacher,okay and make sure you write that down and then i need to know then how many cubes will fit in this box so you used the ruler um hum by five i m going to give you about five more minutes and what i would like for you to do most of you i m noticing are using the cubes you are using the ruler and that s great you need too also tell me how many cubic centimeters fit in this box the volume of the box this is a three dimensional shape and you need to explain to me what you did and do not forget to be specific about the measurement of these boxes because the measurements are very different we measure things differently i m not going to put this box on a scale to determine how many cubes fit in but i might stand on a scale to weigh myself so when we need to determine how much fits in this box we are using different types of measurement so please when you are finished write down in your note book in words how many cubes would fit in this box you have about five minutes
teacher,right now don t worry about it you need to get writing in your math notebook i wouldn t worry about that paper right now okay so you are saying i put cubes around the length of the box and i put some around the width of the box then i added three in the height okay what do you mean you added so you put cubes on the length cubes on the list and then you added so you added just those cubes
student,and then i multiplied it
teacher,okay so you multiplied it so i want you to think more specifically student r think about the length and then you found the length and you knew that there were x amount of cubic centimeters that would fit around the length and then you fund the width and then you found the height and then what did you do with those three dimensions they are called cubic centimeters student c cubic centimeters
student,inaudible
teacher,i like that and i like how you said since the cube is one centimeter it goes it s one centimeter by one centimeter by one centimeter are you okay student m yes
student,are you supposed to write how many cubes you how do you know
teacher,yep i want you to explain it the way you figured it out and what you know about what fits into that box okay
student,okay
teacher,about two more minutes okay so you are saying you got your ruler and you first measured the length and it was eight eight what
student,eight cubic centimeters
teacher,well one side would just be a centimeter and if you put all three sides together then it would create the cube so then that would become the cubic centimeter
student,inaudible
teacher,that was just for last week
student,okay but how many points would you lose
teacher,oh one that was just for last week though
student,i have seven i lost three but i don t know i have seven points i inaudible subtract and then i have seven
teacher,oh you know what i think that was for student m and not you i made a mistake thank you for letting me know i ll fix that because i think that was a monday yes well tuesday um everybody should be finishing up i m going to ask if you are finished one person from each team to take the paper and put it in the recycling the overflowing recycling bin please look on the floor
student,inaudible
teacher,can you give it to student h student j so you don t get up and i m going to ask for volunteers to share their strategy be sure to speak up speak clear so i can hear what you have to say and i m looking to see that we are all paying attention student m nice and loud please tell us exactly what you did and you can lift up your box
student,so i bought my centimeter ruler and inaudible and then the height and then the width and then multiplied the length times the height and got my answer and then times the width
teacher,so you measured the length the height and the width and then you got your answer but can you be more specific because i could do that with any box i can measure the length the height and the width and then get an answer but can you be more specific about the length the height and the width you said you used that ruler and what on that ruler is very important when we are thinking about measurement
student,on the length i got 8 cubic centimeters
teacher,eight centimeters
student,eight centimeters and the length for the height i got
teacher,pay attention please
student,i got four centimeters and for the width i got 5 so multiplied 8 times 5
teacher,you multiplied 8 centimeters times 5 centimeters times 4 centimes and how many centimeters fill a cubic box
student,160
teacher,160 centimeters cubic centimeters anybody do anything different that s what student m did we all did something different some of us may have used a ruler but may have measured differently student c nice and loud please
student,our group took the box and first we tried to figure out the height which was four and then we figured out the length which was five
teacher,five what
student,five centimeters and the width was
teacher,the width was what
student,7
teacher,can you take your ruler and measure that
student,no it was 8
teacher,okay and one more person sharing share share
student,i took the box and i filled the sides like i put the height and i got four and then i found the length and i got eight and then i found the width and i got 4 i mean 5
teacher,5 what 8 what 4 what 6 what 10 what 12 what what
student,centimeters
teacher,centimeters and we are talking about measurement because everything is different when we go to measure i want you to think of different types of measurement for length what are some ways that we measure length so what s one way that we measure length that we just learned about today student r
student,we used a ruler
teacher,i know we used a ruler but what type of measurement is that called
student,centimeters
teacher,centimeters and we would say cm okay that s one way student j
student,inches
teacher,inches student a
student,yards
teacher,yards
student,meters
teacher,meters okay and then what are some of the ways that we would measure the weight of something the weight
student,with a scale
teacher,i know we would use a scale i m not talking about the tool that we would use for the length we would us a ruler i don t want to know the tool for the weight we would hope on the scale i want to know the type of measurement not the tool that we would use student m
student,pounds
teacher,pounds lbs
student,ounces
teacher,ounces
student,gallons
teacher,gallons i don t know the abbreviation for gallons i think it s g but i ll have to check student m
student,quarts
teacher,quarts now let s think about the volume how are we saying how many cubes fit into this box we didn t say 160 centimeters what did we say how many what s the volume of this box student l i want you to take the chance what is so you want to think about the type of measurement we used and we have created a three dimensional shape and we have our box and so we have to find out the volume remember the volume i talked about it s the present that goes inside how would we refer to the volume in this case what type of measurement could we say
student,units
teacher,that is
student,cubic
teacher,cubic so any time we measure the volume we always want to say cubic centimeters if we didn t use centimeters while measuring and we used something else some other type of length what would we call it
student,cubic inches
teacher,cubic inches and that s what we ve been using when we use those other cubes we have actually been measuring using cubic inches now how many times do we multiply to determine the volume how many times do we multiply
student,three times
teacher,three times so instead of writing out cubic centimeters i can take my cm to the third power so cubic centimeters that means we are multiplying three times cubic inches that means we are multiplying three times to determine the volume in this box yes
student,is it square inches too
teacher,no when we are finding the volume we are using cubic when we are finding the volume we are determining whether it s cubic centimeters or cubic inches or cubic meters i am passing out right now some other types of boxes with different types of measurement so you might see feet you might see inches you might see centimeters i want you to determine the volume of each one of these boxes i am going to ask one person from each team to collect the cubes and bring those back to me look on the floor and i need on person from each team to collect the rulers
teacher,paper passers student d and who else i shouldn t hear you yes please thank you you can throw it right in there student a is that extra okay so let s take a look at this what is the formula for finding volume what is the formula we have talked about this the formula the recipe if somebody comes in and they don t know what to do we are going to give them a direction what is the formula for finding the volume
student,length times the width times the height
teacher,length times width times height so you are going to then solve the problems using length times width times height if you want to write cubic feet or cubic centimeters that s fine but what s another way to show cubic without having to write cubic so it could be cm and then 3 the 3 represents the 3 different dimensions any questions okay go ahead and work on that is there anyone who does not understand how to find the volume of a box is there anyone who does not understand who can tell me what the volume of a box determines
student,of how much space of something that can fit in there
teacher,how much space is on the inside when we talk about area we are just talking about a two dimensional part of a shape here and tomorrow we will be working with these boxes i m going to gather and i m going to predict that some of these boxes i m not going to measure using centimeters because it s going to take me a very long time i might use inches when it comes to there s a smaller box i might use centimeters to measure this box but i might use inches to measure this box so that s the type of the unit of measurement that i am going to use and then i want to determine the volume which means how many presents can i fit on the inside of this box okay so what you are going to work on now is in front of you and then we will go over it in a few minutes i don t really think you need to work with a partner but if you are really really stuck then you can ask your partner or somebody at your team but i really don t think you need to work with anyone
student,inaudible
teacher,yes you can show your work on the back
teacher,yes okay student l let me give you your homework
