speaker,cleaned_text
teacher,let s take a look at the board up here and these are some of
student,a number that ends in a zero
teacher,only one of those numbers ends in a zero usually when we re talking about large numbers like hundreds and tens and thousandths they do end in zeros that s landmark in fractions there s some of them listed up there student k
student,a landmark is a number that you can add just to get to like so it can be easier to add
teacher,have we been adding fractions at all when we were adding we used landmarks but these landmarks zero one half one two what are they as far as being a landmark what did we use landmarks for when we were doing adding and subtracting
student,to get us close to 10
teacher,how did that help us
student,it s easier to get to tens when you add with the tens it s easier to subtract 10
teacher,what we re going to be doing is using fractions like one half a whole and one to make it easier to compare fractions let s look at the second part because this is something you guys will be doing also students will use the following vocabulary when comparing numerator denominator greater than less than equal to zero one half one whole two wholes so before we start this why don t we review a little bit of the fraction rules that we talked about yesterday the first one when we talked about a fraction being equal to zero what do we know it s up there yes sir
student,the numerator is zero
teacher,the numerator is always zero we have some examples how would i say this one everybody zero halves and zero sixths when we re talking about a fraction that s greater than zero but less than one half we know that it s greater than zero and we know the numerator is greater than zero and less than half the denominator is this numerator greater than zero
multiple students,yes
teacher,what about this one
multiple students,yes
teacher,okay in each case is the numerator less than half the denominator
multiple students,yes
teacher,what would half the denominator be
multiple students,4
teacher,is 3 less than that
multiple students,yes
teacher,what is the denominator 6 is 2 less than that it s greater than zero less than a half you have a question
student,yes you have a half right there
teacher,where we re not done with this one we re just doing this one we re going to get to half right now because this one says equal to one half numerator is half the denominator or the denominator is double the numerator we re saying the same thing there right okay how about this one is the numerator half of the denominator
student,yes
teacher,is the denominator double the numerator how about in this case yes so that s how we can see if the fraction is equal to or equivalent to one half this next part here announcement so the last one here you can barely see the greater than so greater than a half and less than one whole we know the numerator is greater than half the denominator and is less than the numerator what does that mean think about it student h
student,it means three fourths half of 4 is 2 and inaudible
teacher,so you talk about three fourths can you explain that
student,2 is half of 4
teacher,sorry wrong number there 2 would be half of 4
student,it s greater than half the denominator
teacher,it s the numerator is greater than half the denominator that would be a good example
student,or the denominator is double
teacher,we re done with this one here it s less than the denominator is the numerator less than the denominator
student,yes
teacher,same here
multiple students,yes
teacher,we just did that one how about this one is the numerator greater than half of the denominator what would be half of the denominator
multiple students,3
teacher,is the numerator greater than half of the denominator
multiple students,yes
teacher,is it less than the denominator
multiple students,no
teacher,really the denominator is 6 is 4 less than 6 yes it is let s look at this one what would be half of the denominator 4 is 5 greater than half of the denominator is it less is the 5 less than the denominator 5 is not less than 8 this one is a little tricky it s got a lot of words in there let s look at this one what would half of 3 be yes
student,one and a half
teacher,is 2 greater than one and a half
multiple students,yes
teacher,the second part says the numerator less than the denominator is 2 less than 3
multiple students,yes
teacher,the last one we re going to look at and move that little piece out of there when the fraction is equal to one whole the numerator and denominator are equal is that true here and here
multiple students,yes
teacher,that means it s one whole yes ma am
student,on the fourth whole
teacher,this one here greater than a half and less than a whole which one are you talking about
student,the fourth question
teacher,1 2 3 4 so greater than a half and less than a whole
student,how come the numerator is only one bigger than the half
teacher,on all of them
student,one those ones
teacher,can anybody think of something that would fit into this category the numerator is only one more than half let s think of a denominator eighths okay we have five eighths and student k was talking about four eighths would be a half and five eighths would be just one more eighth more than a half a half is four eighths can you think of an eighth that would be even bigger is that what you re talking about an eighth that would be even bigger
student,seven eighths
teacher,that would be bigger
student,eighth eighths
teacher,would that fit into this category though
student,no
teacher,why not
student,it s too big it equals one whole
teacher,can you think of i can think of one more
student,six eighths
teacher,all right so i m going to put these rules back up when we re playing the game so you can use this language to talk about when you re comparing fractions yes student j
student,i have a question on the last one the numerator and denominator are equal one whole plus one whole equals two wholes
teacher,that s not really what we were talking about but yeah it would yes
student,wasn t there one more explanation for one of them
teacher,what does equal two we re talking about things that are equal to two wholes you can add that up later on so numerator would be double if it was two wholes the numerator would be double can you give me an example
student,three sixths
teacher,three sixths
student,i mean six thirds
teacher,i m talking about thirds one third two thirds three thirds how many more thirds do i have to get to get six thirds three one thirds five thirds six thirds and is that two wholes
multiple students,yes
teacher,okay that would be a good one that might come into our game too student a
student,on the third one
teacher,about half
student,you can also tell that the numerator is half of the denominator
teacher,is that what you had
student,you can tell that because if you just add the numerator the answer will be the denominator
teacher,so like if i said 2 plus 2 is 4 yeah that s doubling yes
student,i noticed that if you do division and you use the larger number divided by the lowest number it equals
teacher,when you say largest number and lowest number what are you talking about
student,for three sixths you can do 6 divided by 3
teacher,so the numerator the denominator divided by what are you talking about use numerator and denominator to help me know what you re talking about
student,if you take the denominator and divide it by the numerator it will equal the numerator again
teacher,so the denominator divided by the numerator 6 divided by 3 okay doesn t work right one more so we can start the game
student,what if we have seven thirds
teacher,what about seven thirds
student,wouldn t it be like 2
teacher,and a little bit more yeah not a half but another third we re going to be talking about that later on but it actually equals two and a third those pages that we have all those fractions why don t you open that we re going to be using that in the game can you make sure everybody gets a piece of scrap paper be very careful with the camera i don t have everybody s attention we re going to play a game comparing fractions and we re going to use landmarks to talk about it i just wanted to remind you to reuse these words numerator denominator greater than less than equal to zero one half one whole two wholes thank you so we re going to use those numbers and we re going to use those words to compare let s take a look at these two fractions you and your partner that i assigned a little bit ago i want you guys to think about how you can compare these two fractions what s the one on the left four tenths what s the one on the right six eighths you and your partner compare them use these words and decide which one is the larger fraction i didn t hear either one of you use greater than less than equal to
student,i think four tenths is greater than six eighths because the denominator is 10 and the number on six eighths the denominator is 8
student,i think six eighths is larger inaudible
teacher,okay guys remember that when we re comparing these fractions i want you to use the landmarks to compare them talk about is it greater or less than a half one whole or two wholes what are you guys talking about
student,inaudible
teacher,i didn t hear that so six eighths is one half
student,no i said four eighths and six eighths is greater than one half
teacher,so which one is larger
student,six eighths
teacher,okay so i want to tell you what i heard and see if you guys thought about it in a different way because there are different ways to look at this i need everybody to put pencils down cards down you don t need anything in your hands right now at all just face this way i heard somebody say if they were dealing with tenths that five tenths would be exactly one half if you agree raise your hand since four tenths is less than this this one is less than one half this fraction here four tenths less than one half everybody agree
multiple students,yes
teacher,okay then i heard this one if you re talking about eighths what would be exactly one half student e
student,four eighths
teacher,so is this one greater or less than one half this one is greater than one half that makes this one six eighths the larger fraction so four eighths i mean four tenths and six eighths what symbol would you use in between those two fractions to make it true greater than less than equal to student a
student,greater than six eighths
teacher,how would you read it we re going to read across
student,four tenths is less than six eighths
teacher,you proved it by comparing both of these fractions to one half that only works when you have one as the numerator in both of them do we have one in both of them
student,no
teacher,but what we want to do is think about compare them two zero one half two wholes comparing this one the closest thing to compare them to is one half can i have you sit up please thank you i m going to give you two more to look at with your partner if you need to get them out or draw them that s okay i don t have everyone s attention yet these are the two fractions how do we say this one nine fourths and this one one and one fourth so we want to use these terms and these student l i would really like to have your attention use these landmarks to compare these two fractions work on that with your partner you guys should be talking with each other two what
student,two wholes and one fourth and two wholes is bigger than one fourth
teacher,it s up on the board we re comparing those two fractions figuring out which one is larger so conversation i just heard they were talking about wholes and they said that this one is actually the same thing as two wholes plus one fourth and this one here is one whole plus one fourth student l said that two wholes is bigger than one whole so this has got to be the larger fraction if i wrote the fractions out what symbol would i use in between them to make it true student l
student,greater than
teacher,so nine fourths is greater than one fourth
multiple students,yes
teacher,greater than one and one fourth everybody understand what they re doing don t understand anybody need help before we start the game yes
student,inaudible
teacher,student l said he could see two wholes plus one fourth so three fourths 5 6 7 8 fourths nine fourths so he s saying when you draw that fraction it makes two wholes plus a little bit more and one whole plus a fourth you only see one whole plus a little bit more this part has two wholes that one makes one whole that makes this larger you ve got a question too
student,what s it going to be about
teacher,comparing fractions a whole bunch of different ones this is what i need you to do put all the cards together in one pile and flip them over if you have four people using the same deck they should be right in the spot where everybody can get to them you re going to play with your partner and each person is going to take one card from the top let s start with that play with your partner if your fraction is larger you get to keep both of them if the other person s fraction is larger they get to keep both of them if your fractions are exactly the same you get your own card and keep them you keep playing until all the cards in the deck are done what you can do after that is shuffle up the cards and go again before we start student j has a question i m sure everybody s going to be paying attention to student j s question yes
student,is it the person with the most cards wins
teacher,yes we have a question here
student,the person that has the most cards do you start over
teacher,when all the cards are done you shuffle them up and start the same way you don t get the same cards each time use these words when you re talking about them student c has a question
student,inaudible
teacher,student j said does the person with the most cards win the answer is yes you re only playing with one partner i think you ll understand this a little bit more once we start playing so let s start playing which one is the largest tell me the fraction you re talking about two and one half is the largest or the smallest how do you know how many wholes does nine sixths have what about eight ninths okay what have you got you have five fourths and you have three sixths how can you tell that five fourths won i didn t hear you talking about it with vocabulary words which one do you think won five fourths or three sixths
student,five fourths because this is over one whole and this one is less
teacher,so this is a whole plus a little bit more how about this one three sixths look like any other fraction you know why one third one half why do you think it looks like one half what happens when there s a tie you don t both lose you each get your own card what s that why is three sixths equal to a half use the vocabulary pardon less than what think of three sixths you said it looks like a half why does it look like a half they go together are you looking at the shaded part and say they go together how does it mean it s a half how many pieces are there all together
student,6
teacher,how many are colored in
student,3
teacher,can you guys remember anything from what we were talking about earlier they re equal to the same thing using some of the words we talked about including the vocabulary up on the smart board how can you say that three sixths is equivalent to one half the denominator is double the numerator and that makes it a half you re right which is larger good explaining using the vocabulary if you used all the cards you can mix them up again did you count the cards you can mix them up and play again student h what did you have i didn t hear any discussion going on
student,two thirds
student,eight eighths
teacher,so that s one whole what about yours student j
student,my numerator is less inaudible
teacher,i don t remember that being in the rules is his bigger or smaller than this how come yours isn t a whole two fifths
student,because only two are shaded of the whole
teacher,what would it have to be if it was a whole
student,five fifths
teacher,is it greater or less than five fifths
student,less
teacher,so yours is less than a whole and his is the whole so is his the greater one good student c what are you guys working on you guys used all the cards now let s put them in one big pile so you can get more more practice that s all you re just getting all the cards maybe this time it will be inaudible mix up the cards so we can get playing maybe your cards will change this time that s all we can do is hope show him your cards he has eight sixths and you have two fourths who won
student,he did
teacher,why
student,because he has like two wholes and like
teacher,two wholes
student,i meant
teacher,sit up
student,he has one whole and two sixths
teacher,okay
student,he won
teacher,what is yours equal to
student,one half
teacher,so one half is less than he s got one whole plus a little bit and you have less than a whole
student,yes
teacher,you can use the whole to compare them he has more than a whole you have less than a whole okay good what do you have
student,i have two wholes and one half
teacher,so what s your fraction
student,five halves
teacher,how do you say yours inaudible which one of these two is larger why is yours larger
student,i have two wholes and one half and student n has three thirds
teacher,so you re comparing wholes okay he has two wholes plus some okay you re getting some of them you re winning student j here they are you won again what do you have student j you have to turn them over let me see the cards who won here what landmark can you compare these to
student,this one is greater than this one
teacher,what landmarks can you use you have zero half whole two wholes what one do you compare these to i wouldn t say zero because neither one of them are zero would you use one whole or two wholes which one would you use half so what do you know about this one compared to a half one sixth compared to a half if i was working with 6 what would half of 6 be is that one greater or less than a half how about this one what would be less than 5 is 4 greater or less than half which one is bigger yours is less than half and his is greater so which one is larger his good how about another one you would be happy that you had that i don t really hear a discussion you guys didn t use any of the landmarks or anything three eighths is a half
student,no 4 is half of 8
teacher,so three eighths is less than four eighths less than a half and his is
student,greater than a half
teacher,so whose is better bigger good what do you guys have now i like this is this the one you guys just played four thirds and one and a fourth who had which one how did you guys decide which one was larger
student,inaudible i only had four thirds
teacher,yours is smaller than hers how do you know you both have one whole right so you re kind of equal on those how do you know
student,inaudible
student,hers is bigger than mine
teacher,you tell me you say three thirds and one whole cancel each other out you guys know how to figure this out i ll open the window you ve got to if you re talking about math that s all right but you need to calm it down a little bit there s lots of play going on over here you re only supposed to be playing with your partner i assigned you partners already we re back to the one fourth and what part of the fraction would that be how do you know it s bigger
student,it takes three of mine to finish the whole
teacher,what s bigger a fourth or a third a third is bigger but here is three pieces and there is four pieces remember how we talked about the more pieces the smaller they become mix them up again once again partners you probably have time for another round or two you won three times excellent you guys are shuffling up cards still how many cards are there all together 40 if you ve got 18 how many does he have
student,22
teacher,shuffle them up three of you guys can play you just won that s fine who won who got three sixths what do you have who won which fraction which landmark fraction could we use to compare these put that back up announcement he has two sixths you have three thirds which landmark can we use to compare these we talked about
student,half
teacher,is student j s greater or less than a half
student,less
teacher,how do you know so three sixths would be a half does he have more or less than half i need you to sit up how about what s half of 3
student,two and a half
teacher,plus three and a half equals 3
student,one and a half
teacher,one and a half out of three would be the same thing as a half is yours greater or less than a half
student,greater
teacher,make sure you use the landmarks you rounded it to three are you going to play if you don t care then don t play it you guys can play by yourselves if he doesn t want to play so what we re going to do in just a few moments is talk about what strategies did you use to make sure that you know what you re talking about as far as the cards go while you re playing for the next couple of minutes i want you to think about what are you doing to figure it out hopefully we ll be hearing a lot of people talking about using the landmarks because that s what this lesson is supposed to be about we re going to play for three more minutes then make a list of things continue whoever is doing purple has a card on the floor over here keep going i would say that looks like pretty darn big pile i would say whoever had that stack probably won shuffle them really quick can we get the game started this one is interesting use some landmarks you have one fourth and you have two fifths what landmark could you use to compare these you can use halves so yours greater than half or less than half how do you know
student,2 plus 2 equals 4
teacher,so two and a half would be half of five
student,mine is less
teacher,how about yours how can you tell if you re working with halves
student,inaudible
teacher,you re both less than half you have to figure out who is closer to a half
student,i think i am
teacher,one half of these rectangles half of one of the she needs a half and a fifth one half of the rectangles to have it be a half and you need how much to make a half who is closer to a half who won that was a tricky one remember later on in the week we re going to talk about how you can use different kinds of fractions
student,inaudible
teacher,that s what happened
student,it s not about winning or losing
teacher,it s about learning something where is your card
student,we re going to start right now
teacher,seven eighths and four tenths good put them down so i can see for a second three halves one and three fourths eight twelfths okay bad dog okay so let s talk about what are some of the things we did i don t have everybody s attention let s put all of the cards down don t need anything in your hand right now at all so what were some of the strategies that you used to compare your fractions
student,look at the picture and see who has more fractions
teacher,you re definitely going to use the picture okay so how many people used the picture to help them how did we use the picture what did you do
student,if you i looked at the shaded ones inside and saw which ones if all of them were shaded in then it was a whole and that helps me because inaudible
teacher,you did what
student,inaudible
teacher,so two boxes are the same whole or two wholes
student,two shaded in
teacher,what fraction were you talking about do you have an example what s that nine fourths so you had two wholes what did your partner have remember did your partner have less than that what landmark did you use to help you compare
student,two wholes
teacher,so you used landmarks for that one and two wholes i bet you did you win or did your partner win
student,i did
teacher,your partner didn t have two wholes shaded in
student,he did but i had more
teacher,oh so you used you compared you each had two wholes and then you looked at what was left can we think of that maybe as a remainder almost what was leftover if you had two wholes and he had two wholes you just thought of the rest of it what else did you use did you use the landmark one half
student,student a had four fifths and i had seven eighths inaudible
teacher,what were the fractions you used seven eighths and four tenths
student,i said i had passed the half and he inaudible
teacher,so what was the half mark for three eighths
student,four eighths
teacher,you were past that
student,yes
teacher,what would be the halfway mark for tenths five tenths and you hadn t quite made it yet this one was greater than this one anything else anybody used anybody know how to use any other strategies at all
student,inaudible
teacher,when you re saying look the numbers are you talking about numerator denominator what are you talking about
student,the denominator because if the denominator is bigger then the numerator i think you inaudible
teacher,always does that turn this one which one had the larger denominator
student,four tenths
teacher,can anybody think of an example if we had eighths and tenths how the one with the larger denominator actually might win this time they lost but can you think of a situation where if you had tenths you actually had a bigger fraction than the person who had eighths
student,i have a question do they have to be inaudible
teacher,no
student,it could be five tenths
teacher,which would be what
student,half
teacher,and three eighths
student,would be less than half
teacher,so that could happen can you only look at the denominators or do you have to look at the numerators also student a
student,inaudible
teacher,how do you figure out if they re both equal
student,the numerator has to be half of the denominator
teacher,in each situation so if it was four eighths and five tenths they would be equal
student,yes
