speaker,cleaned_text
teacher,okay i think it s working and the person who s delivering the camera will be in in a second just to double check it but it should be recording now okay
student,inaudible
teacher,everybody want to smile for the camera
student,hey
teacher,okay
student,is it gonna be in black and white
teacher,is it gonna be in black and white i don t think so i think it s probably in color
student,i bet it s inaudible
teacher,let s just make sure before we start okay that it s working
multiple students,inaudible
teacher,boys i need you to put that away please these lights didn t come on and these went on so i put these on and then i waited a little bit and i hit that
teacher,and then they all lit up so we re recording right we re on
teacher,okay i wanted to double check
teacher,thanks all right student d away with that please it s on okay guys take a look at the back of the room the math objectives today students determine the number of cubic centimeters that fill an unmarked box an unmarked box up until now we ve been putting together boxes and packing them with packages cubes that made up packages to see how many of those packages would fit these boxes were marked today is gonna be a little different today you re gonna work in groups of two this is a group this is a group you two boys in the back are a group you two are a group and you two will be a group okay
student,inaudible
teacher,today s a little different today they re not telling you they re not putting marks on the box it s unmarked you re gonna construct one box and unlike the other boxes this box is gonna have a top and what we re gonna do is we re gonna find out how many of these cubic centimeters can fit inside the unmarked box see the problem is though i don t have enough cubic centimeters for everybody to just pack these in and line up the whole bottom and find out how many levels high it is okay we re gonna have to figure out another bit i m not gonna give you any help on this i need you guys to figure it out we have supplies over there and i ll have you guys go and get them but first i want to show you guys how to make the box okay so over there you re gonna find this sheet you need one per group okay and you ll work with your partner figuring this out so you ll take that sheet and you re gonna cut out the pattern okay and when you cut out the pattern it s gonna look like this
student,don t cut that across
teacher,what you re going to do keeping the lines on the outside don t fold up the lines on the inside you just want to make a fold everywhere that there is a line okay so i folded wherever there was a line and i have something like this today we re not gonna leave a side open we re gonna tape down all of our edges okay you re gonna see class that it would normally look just like we would do before you would go ahead and you would fold them up and you ll tape em but you re gonna have this piece on the top that s higher right student d can you look up here this piece is gonna be higher this is gonna be the lid can you guys see that so when you re all done and you tape the four sides together just fold the lid down and tape it and in the end you will have this box that s completely closed you won t be able to put anything inside it and that s the plan so that you ll be able to figure out how many cubic centimeters could go inside it without actually putting them inside it i have 20 cubic centimeters for each group so take a dixie cup there s 20 of these cubic centimeters inside them obviously that s not enough to fill up this whole box but it s certainly enough for you to use it as a tool to figure out a way to find out what the cubic volume is for this box okay in cubic centimeters i also put out some centimeter rulers they might help you as well i d really like to see if people can do this two different ways okay using these and using the rulers okay any questions yes
student,do we have to do it two ways
teacher,well you want to start by doing it one way right and then if you have time before everybody else catches up i would definitely recommend challenging yourself to do it another way
student,oh okay
teacher,so we re gonna tape these edges down guys and when we re all done this is gonna be a closed box
student,inaudible tape
teacher,okay you won t need a whole lot of tape but i tell you from making these in the past guys i have found it the best way the most important thing you gotta do at the beginning is when you make these folds really fold them good on that line make sharp sharp folds because that s gonna set up the edges of your box really well okay
student,inaudible
teacher,find one person from each group and you guys head up
multiple students,inaudible
teacher,you need a pair of scissors some tape just a pattern sheet dixie cup and a ruler
student,can we move inaudible
teacher,no i moved you guys here because the camera is close to this area and i want the camera to see what you guys are doing
student,oh
teacher,is that okay with you i d actually like it more if you moved from here to here with your partner if you gave up that desk okay because your head s kind of right on that lens yes sir
student,inaudible questions what is this
teacher,that s a microphone i m sorry
student,inaudible
teacher,yes you may keep the door closed today okay
multiple students,inaudible
teacher,guys can i have your attention for one second i put this out there i didn t bring it up i just saw student d do something pretty cool he sat right down at his desk took the centimeter paper and took one of these cubic centimeters and placed it right on top and i could see that little idea going on there i think he s got another idea of a way maybe he can use this to help him figure out what the volume is for this box but i better stop talking right cause you were flying right on your own
multiple students,inaudible
teacher,student d you want to make a box too
student,hm
teacher,you want to do one too
student,yeah
teacher,go ahead put another piece of paper over it you guys do two of them student h you want to make a box as well go ahead
multiple students,inaudible
teacher,student j you want to cut another box too one of your own or do you want to just work off of one okay it looks like you guys will work through this pretty quickly so if you do want to cut another box out do it now okay student a do you want to cut another box out and do two of these
student,yeah
teacher,or do you want to just work off of one here
student,two
student,two s okay
teacher,you gotta move quickly though okay
multiple students,inaudible
teacher,it starts with cutting this pattern out though okay boys
student,okay
teacher,no no no no no guys do me a favor okay before you do anything you have to make the box so don t start playing with the cubes or the rulers or the centimeter graph paper all right and fill the box cause we can t start until this thing s closed and has form okay hold em up tape the edges
multiple students,inaudible
teacher,you guys have the lines on the outside right
multiple students,inaudible
teacher,you re welcome
student,thank you
teacher,you re welcome
student,inaudible
teacher,gotta go quick
student,inaudible
teacher,nice
student,i only need one more piece of
teacher,yes you have to close the lid and tape it shut make sure you make good creases on your edges guys it ll make the box have a better form
student,can we use a pen to inaudible
teacher,you can use whatever you like
student,those are my scissors
teacher,they are are these fine student d
student,yeah
teacher,you guys gotta get that taped up
student,inaudible
teacher,how are you doing
student,we don t want to have to like put em all in the boxes and get inaudible be like the side and this and that s sort of like this that so i m gonna just see how much will fit on this side and see how much will fit right there and then times it
teacher,okay when you say side you know it would be good if you can use the word edge that s an edge right those are edges it s good math talk so you re finding how many cubes will fit on the
student,on one of the edges
teacher,how many different edges do you think you re gonna have to take care of here
student,only two four
teacher,four two show me the edges that you re gonna do
student,i m gonna do this one and that one
teacher,okay and that s it
student,yeah because that s the same as that one that s inaudible that one
teacher,okay and so if you figured that out that s gonna be able to tell you how many cubes will fit in the box
student,no i will figure out how much will fit on the bottom and then i ll have to do that right there to see how high it is
teacher,all right where are you guys
student,inaudible sides open
teacher,no sides open tape it shut
student,there s no more tape on this thing
teacher,okay let s get you another one here you go
student,thank you
teacher,get moving student d is that one done
student,yeah
teacher,get cooking
student,eight times five one two three four five six seven eight so eight times five
teacher,you can use this to write on
student,that s 40
multiple students,inaudible
teacher,it looks good guys
student,shut it s open
teacher,you want a little help taping that that s not bad
multiple students,inaudible
teacher,student a they re just trying to help you what s your question
student,i just want some inaudible to inaudible
teacher,that one s yours i did one piece is what one centimeter
student,so inaudible
teacher,that is one cubic centimeter yes
student,four
teacher,student a what are you doing
student,we re trying to find the volume
teacher,i know but tell me what you re doing to do it
student,this equals four inaudible one centimeter we re gonna measure what the centimeters inaudible and go four and inaudible and from the volume inaudible
student,modify the bottom times inaudible
teacher,what do you call this part of the prism
student,surface
teacher,the surface area is what covers the entire outside right the area of all six faces but these what are these called what you re gonna measure
student,inaudible
teacher,yeah but it s
student,length times width times height
teacher,well that s the volume that s the formula for volume yes and it sounds like that s the direction you guys are going but you said that you were gonna measure this right and that was the word you used this it s the height but what part of the prism is it it begins with an e
student,edge
teacher,it s the edge good job okay so you re gonna measure that edge and then what are you gonna do
student,measure the inaudible
teacher,measure
student,the wait where inaudible
teacher,okay so those are the edges too right right so there s three different edges of the prism you re gonna measure
student,then we re gonna
teacher,and what are you using to measure the ruler
student,and after that we re gonna move the all the inaudible
student,can i start the recorder inaudible
teacher,it starts from the inaudible point you want to start from right there yeah
student,and remember we re gonna make the same inaudible
teacher,student a why don t you go ahead and do what you re doing with the ruler maybe write out your formula on this plug em in from what you get from that and then see if you can use these without the ruler to figure out a way to find the volume
student,i am
teacher,okay
student,inaudible
teacher,yeah guys we gotta get cooking here come on
student,but it s hard because
teacher,let me give you a hand taping this up this is fine
student,i m used to the thick tape too bad we don t have none
teacher,you re right it s a little tricky ha
student,see
teacher,remember guys this box it doesn t have to hold water it just has to hold its form okay
student,i thought it had to be taped good
teacher,not too good just enough to hold it together you re not gonna be playing catch with it are you
student,no
teacher,i think that s fine let s put one more piece of tape on it right there
student,right here
teacher,yeah good i think you re in good shape
student,good my desk is right here
teacher,yours is fine too
student,yeah
teacher,it s great so go ahead and start up you ve got the tools you need right here you can use this to write on all right student j what are you guys doing
student,i used these cubes and inaudible to help me and inaudible and figured out that this one was eight
teacher,eight what
student,inaudible
teacher,eight
student,centimeters
teacher,okay eight centimeters right you re measuring length here
student,oh
teacher,what is this called what part of the prism
student,inaudible
teacher,this is a face right so these are called what
student,edges
teacher,yes perfect so you said that this edge was eight centimeters all right then what d you do
student,inaudible the ruler i did it inaudible to help me and this is five centimeters inaudible i did eight times five that was 40 and i m trying to figure out
teacher,okay i know where you are going i know exactly that s great student j are you following this are you guys working together or independently here i want you working together
student,inaudible
teacher,yeah i want you guys discussing it
student,okay
teacher,i think student h needs to hear those words that you just told me all right
student,okay
teacher,why don t you guys sit at the yes
student,my mom wants to know if you have any papers for tutoring of math
teacher,for volume
student,no
teacher,or in general
student,yeah
teacher,yes let s talk about that after the lesson and the answer is definitely yes
student,inaudible
teacher,yeah but don t share it with everybody okay
student,i know what it is
teacher,what is the answer
student,inaudible
teacher,nope
student,why is it no
student,i told you you gotta put l times width times height
teacher,160 is what
student,the answer is
teacher,what 160 toes
student,160 feet
teacher,what what what
student,cubic units
teacher,what kind of cubic units
student,centimeters
teacher,so what is the answer
student,160 cubic
teacher,what is the answer
student,centimeters
teacher,the whole answer
student,160 cubic centimeters
teacher,all right let me see gotta identify the unit okay in the proper per unit you gotta do it because the rubric is not gonna allow me to give you credit if you don t
student,so is that the answer
teacher,yeah it s actually like this student d but we re gonna talk about that when we go over it okay that means cubic centimeters three means cubic it means centimeters times centimeters time centimeters but i don t want to talk too loud because we re gonna do that as a class discussion okay but that s how it should look that means cubic centimeters
student,we got ours three ways
teacher,you did
student,we did
teacher,nice nice labeling there i like it
student,we did this then that then that
teacher,awesome all right where you guys at
student,inaudible
teacher,okay we re still taping let me have this please
student,inaudible
teacher,you know what this is real tight it is not necessary it just have to have form okay
student,that s cool
multiple students,inaudible
teacher,okay use the hand crank one
student,three rulers
teacher,okay that s fine all right what are you guys gonna do here how are you gonna measure this out how are you gonna find the volume in cubic centimeters
student,centimeters right are we doing centimeters
teacher,yes we are
student,this will be seven and this will be
teacher,don t say inches if we re doing centimeters let me see where you re starting from
student,inaudible
teacher,student a put that down let him finish it up now look right here this is where it starts okay this is just dead space right here you have to line it up with the beginning part
student,i mean eight eight centimeters
teacher,okay why don t you so what s eight centimeters
student,inaudible
teacher,what is you just told me a number you put the ruler down on part of the prism and you just said eight centimeters that s good i agree with you i think that that s eight centimeters but what part of the prism is this
student,that s the perimeter
teacher,it s not the perimeter the perimeter is the length around an object okay
student,you said right here
teacher,yeah but it didn t go all the way around
student,oh
teacher,look member when we talked about prisms okay and we said how many faces does a prism have a inaudible prism
student,six
teacher,you re absolutely right top and the bottom the front and the back and the two sides that s six and this part these have a name too these parts what are these called you just measured one of them it begins with an e
student,angle
teacher,no that begins with an a
student,it begins with an a
teacher,no the word i m looking for begins with an e and it s this part of the prism it s all these parts what are these called what do you call this right here if this is a ruler what part of the ruler is this
student,this
teacher,isn t it the edge of the ruler okay so mathematically we refer to these parts of a rectangular prism as the edges that s pretty straightforward right so what you told me was you said that this edge was what
student,eight centimeters
teacher,why don t you go ahead and write that down somewhere what do you think you do next student a
student,inaudible
teacher,yeah what do you think you do next
student,inaudible
multiple students,inaudible
teacher,you better pay attention because you re gonna get to do the next one
student,inaudible
teacher,do you need to do another edge maybe there s another edge you need to measure
student,you have to measure the bottom i mean the edge inaudible
teacher,okay so maybe what
student,five centimeters
teacher,okay let s write that down so you ve got eight centimeters and five centimeters write down the formula for volume okay now you ve given me this number and this number two different edges
student,i need one more inaudible
teacher,right one more dimension looks to me like these edges are representing dimensions right if we can plug these in which one are you missing
student,oh the height
teacher,okay student a you figure out the height which one of these edges is the height now you ve done this edge and you ve done this edge where the height edge i think the key is just to keep the thing on the ground if you did this otherwise see it student a i think the problem is you guys are picking this thing up and then you lose sight of you know if you just left it on the ground you can see obviously the height i mean if we put it like this the height might be different or even like this but if you just let it stay still it s a lot easier to see what you ve gotta do you finished it off i m gonna check on you in one minute how we doing guys
multiple students,inaudible
teacher,okay student d let s concentrate on what s going on here okay what is the second width
student,i told him we can use this for a second width
teacher,okay
student,cut it out
teacher,the first thing you did was you used these
student,use this
student,not really
teacher,what s the first way you did it
student,well i just did that to see how much was there how much was there and how tall it was and then
teacher,is that right
student,yeah
teacher,and what do you want to do for a second way student n
student,i want to tease him because inaudible centimeter work paperwork does
teacher,okay and how would you do it let s put this thing into
student,cut five by eight by four out
teacher,so if you cut out five and then try to line that up that would do it too and then plug it into your formula hah good how we doing
student,i found the answer
teacher,whispering what s the answer you got it how did you find the answer
student,we worked together
teacher,i know what did you do when you were working together student h
student,inaudible the width we got four and then we just times 40 times 4 and then we got inaudible
teacher,did you use the ruler or did you use the cubes
student,inaudible
teacher,nice could you use this paper to figure it out
student,i was just figuring it out right now i was like that i was thinking that these are the same size and so inaudible
teacher,sure yeah that s great if you knew this was by putting this down that s what student d had done right at the beginning and then he could just line this up depending on which face he wanted to get nice good job guys all right did you guys finish it because we re gonna go over this guys what d you get
student,166 inaudible
multiple students,inaudible
teacher,guys inaudible yes you guys haven t done that yet
student,oh no we did we did we did that
teacher,did you use these to do it
student,yeah we used those and we used inaudible
teacher,okay and what d you come up with for an answer
student,160
teacher,no
student,cubic inaudible
teacher,cubic what
student,cubic inches
teacher,inaudible cubic what
student,centimeters
teacher,yeah cubic centimeters good job student d guys take all of the cubic centimeters the little red cubes the cubic centimeters put them in the dixie cup return the dixie cups leave everything else on your desk the rulers and the paper i just want the dixie cups with the red cubic centimeters returned keep everything else yeah inaudible the tape that s fine
multiple students,inaudible
teacher,okay i need some help i need people looking forward i need somebody to help me out i gotta get at least two ways done here of finding out what the volume of this closed box was this unmarked closed box i ve walked around with everybody a few people i know you guys were very successful at it and you guys everybody found success here
student,yeah
teacher,okay it was pretty straightforward you guys have been working towards this volume thing very well you re coming in on a monday after having a couple days off and everybody was able to get right to it without much instruction from me you all knew what to do you all remembered the formula for finding volume and you looked for ways to use it all right tell me one way you used it we ll start with you guys student j and student a what did you do
student,inaudible
teacher,so right off the bat you just wanted to get that length times width times height thing going hah and that equals volume okay and what was your first method of solving for the unknown volume of this box what tool did you use
student,inaudible
teacher,okay okay so you started with the ruler and what did you do
student,we knew that each one of those red squares was one centimeter so then we
teacher,student n you need to go back to your seat and student d you need to leave whatever that is in your desk with your hands away from it okay
student,so then we measured which edge
teacher,yep wow look at that guys hear that math talk going on there she s referring and i ve seen this come up guys i ve seen this come up on assessments where they use this word edge and i tried to talk to each group about it because if you don t know what an edge is and they say what is the length of this edge and you re like wow what s an edge it s the easiest question in the world if you just know what an edge is and if you don t know what an edge is you re probably not gonna get it so say it again i m sorry to interrupt you what did you do
student,we measured each edge and after we got we measured the length and then we measured the width
teacher,okay so what was the length
student,the length eight
teacher,so the length was eight centimeters and what was the width
student,five
teacher,five centimeters and that just left one more thing to figure out using the ruler they re back at it
student,four
teacher,four and these rulers are a little tricky because you have to slide it up a little bit where that ruler starts that first centimeter or so is kind of dead space on the ruler you have to be careful there and it was four centimeters so what was your next step then to calculate the volume
student,inaudible
teacher,okay multiply them out five times eight was 40 times four four times four is 16 it s gonna be ten times that because of the zero 160 correct answer
multiple students,no
student,no 100 percent wrong
student,inaudible
teacher,now when we started this unit we started writing the answer as cubic centimeters and i said write out cubic units if they don t tell you what the unit is or cubic centimeters today the official way to really write this guys is to write down the unit measurement and then put down a three an exponent three so in this case it was centimeters and you put a little three there that means cubic centimeters okay yeah this means centimeters times centimeters times centimeters okay we ve done exponents right when we talked about this we talked about 10 to the third power or ten cubed you remember when we talked about it we said we can call that ten cubed or we can call it ten to the third power most people refer to it as ten cubed because it s ten times ten times ten and if you think about it that s length times width times height and that will make a cube that would be ten whatever
student,inaudible
teacher,much easier guys this is the abbreviation for cubic okay for volume it s a little easier than writing out cubic centimeters you just put a little exponent three up there next to the abbreviation for centimeters okay somebody else so that was with the ruler what else did somebody else do just talk me through it another way what did you guys do
student,we did
teacher,listen up guys cause i know some people did this three different ways which one are you gonna tell me about
student,cubes
student,the cubed centimeters
teacher,okay so you used the cubes to figure it out and what did you do listen up guys what did you do
student,for the length we turned it upside down and then you taught us like you don t want to have like put every cube on there if one side equals the other side and the other side equals the other side just do one side one edge and then do the other edge and times those two
teacher,okay
student,and then that was five and eight and then you got 40 and then we measured the height
teacher,which is another edge
